17:05:35.295759 IP 10.0.5.3.37798 > 10.0.1.1.12345: Flags [S], seq 139480223, win 42340, options [mss 1460,sackOK,TS val 32347661 ecr 0,nop,wscale 9], length 0
17:05:35.295772 IP 10.0.5.3.37798 > 10.0.1.1.12345: Flags [S], seq 139480223, win 42340, options [mss 1460,sackOK,TS val 32347661 ecr 0,nop,wscale 9], length 0
17:05:35.295810 IP 10.0.1.1.12345 > 10.0.5.3.37798: Flags [S.], seq 4206956474, ack 139480224, win 43440, options [mss 1460,sackOK,TS val 978130979 ecr 32347661,nop,wscale 9], length 0
17:05:35.295822 IP 10.0.1.1.12345 > 10.0.5.3.37798: Flags [S.], seq 4206956474, ack 139480224, win 43440, options [mss 1460,sackOK,TS val 978130979 ecr 32347661,nop,wscale 9], length 0
17:05:35.295885 IP 10.0.5.3.37798 > 10.0.1.1.12345: Flags [.], ack 1, win 83, options [nop,nop,TS val 32347662 ecr 978130979], length 0
17:05:35.295886 IP 10.0.5.3.37798 > 10.0.1.1.12345: Flags [.], ack 1, win 83, options [nop,nop,TS val 32347662 ecr 978130979], length 0
17:05:35.296017 IP 10.0.1.1.12345 > 10.0.5.3.37798: Flags [P.], seq 1:17, ack 1, win 85, options [nop,nop,TS val 978130979 ecr 32347662], length 16
17:05:35.296018 IP 10.0.1.1.12345 > 10.0.5.3.37798: Flags [P.], seq 1:17, ack 1, win 85, options [nop,nop,TS val 978130979 ecr 32347662], length 16
17:05:35.296023 IP 10.0.5.3.37798 > 10.0.1.1.12345: Flags [.], ack 17, win 83, options [nop,nop,TS val 32347662 ecr 978130979], length 0
17:05:35.296024 IP 10.0.5.3.37798 > 10.0.1.1.12345: Flags [.], ack 17, win 83, options [nop,nop,TS val 32347662 ecr 978130979], length 0
17:05:35.296293 IP 10.0.5.3.37798 > 10.0.1.1.12345: Flags [P.], seq 1:4, ack 17, win 83, options [nop,nop,TS val 32347662 ecr 978130979], length 3
17:05:35.296293 IP 10.0.5.3.37798 > 10.0.1.1.12345: Flags [P.], seq 1:4, ack 17, win 83, options [nop,nop,TS val 32347662 ecr 978130979], length 3
17:05:35.296298 IP 10.0.1.1.12345 > 10.0.5.3.37798: Flags [.], ack 4, win 85, options [nop,nop,TS val 978130979 ecr 32347662], length 0
17:05:35.296299 IP 10.0.1.1.12345 > 10.0.5.3.37798: Flags [.], ack 4, win 85, options [nop,nop,TS val 978130979 ecr 32347662], length 0
17:05:36.282321 IP 10.0.5.2.39632 > 10.0.1.1.12345: Flags [S], seq 1081348129, win 42340, options [mss 1460,sackOK,TS val 2100873201 ecr 0,nop,wscale 9], length 0
17:05:36.282344 IP 10.0.5.2.39632 > 10.0.1.1.12345: Flags [S], seq 1081348129, win 42340, options [mss 1460,sackOK,TS val 2100873201 ecr 0,nop,wscale 9], length 0
17:05:36.282371 IP 10.0.1.1.12345 > 10.0.5.2.39632: Flags [S.], seq 520482402, ack 1081348130, win 43440, options [mss 1460,sackOK,TS val 226770325 ecr 2100873201,nop,wscale 9], length 0
17:05:36.282395 IP 10.0.1.1.12345 > 10.0.5.2.39632: Flags [S.], seq 520482402, ack 1081348130, win 43440, options [mss 1460,sackOK,TS val 226770325 ecr 2100873201,nop,wscale 9], length 0
17:05:36.282406 IP 10.0.5.2.39632 > 10.0.1.1.12345: Flags [.], ack 1, win 83, options [nop,nop,TS val 2100873201 ecr 226770325], length 0
17:05:36.282407 IP 10.0.5.2.39632 > 10.0.1.1.12345: Flags [.], ack 1, win 83, options [nop,nop,TS val 2100873201 ecr 226770325], length 0
17:05:36.282502 IP 10.0.1.1.12345 > 10.0.5.2.39632: Flags [P.], seq 1:17, ack 1, win 85, options [nop,nop,TS val 226770325 ecr 2100873201], length 16
17:05:36.282503 IP 10.0.1.1.12345 > 10.0.5.2.39632: Flags [P.], seq 1:17, ack 1, win 85, options [nop,nop,TS val 226770325 ecr 2100873201], length 16
17:05:36.282507 IP 10.0.5.2.39632 > 10.0.1.1.12345: Flags [.], ack 17, win 83, options [nop,nop,TS val 2100873201 ecr 226770325], length 0
17:05:36.282508 IP 10.0.5.2.39632 > 10.0.1.1.12345: Flags [.], ack 17, win 83, options [nop,nop,TS val 2100873201 ecr 226770325], length 0
17:05:36.284628 IP 10.0.5.2.39632 > 10.0.1.1.12345: Flags [P.], seq 1:4, ack 17, win 83, options [nop,nop,TS val 2100873203 ecr 226770325], length 3
17:05:36.284634 IP 10.0.5.2.39632 > 10.0.1.1.12345: Flags [P.], seq 1:4, ack 17, win 83, options [nop,nop,TS val 2100873203 ecr 226770325], length 3
17:05:36.284653 IP 10.0.1.1.12345 > 10.0.5.2.39632: Flags [.], ack 4, win 85, options [nop,nop,TS val 226770327 ecr 2100873203], length 0
17:05:36.284655 IP 10.0.1.1.12345 > 10.0.5.2.39632: Flags [.], ack 4, win 85, options [nop,nop,TS val 226770327 ecr 2100873203], length 0
17:05:36.297312 IP 10.0.5.3.37798 > 10.0.1.1.12345: Flags [F.], seq 4, ack 17, win 83, options [nop,nop,TS val 32348663 ecr 978130979], length 0
17:05:36.297315 IP 10.0.5.3.37798 > 10.0.1.1.12345: Flags [F.], seq 4, ack 17, win 83, options [nop,nop,TS val 32348663 ecr 978130979], length 0
17:05:36.300415 IP 10.0.5.3.56438 > 10.0.1.2.12345: Flags [S], seq 1909801028, win 42340, options [mss 1460,sackOK,TS val 2438477704 ecr 0,nop,wscale 9], length 0
17:05:36.300432 IP 10.0.5.3.56438 > 10.0.1.2.12345: Flags [S], seq 1909801028, win 42340, options [mss 1460,sackOK,TS val 2438477704 ecr 0,nop,wscale 9], length 0
17:05:36.300529 IP 10.0.1.2.12345 > 10.0.5.3.56438: Flags [S.], seq 1958466744, ack 1909801029, win 43440, options [mss 1460,sackOK,TS val 3416587789 ecr 2438477704,nop,wscale 9], length 0
17:05:36.300543 IP 10.0.1.2.12345 > 10.0.5.3.56438: Flags [S.], seq 1958466744, ack 1909801029, win 43440, options [mss 1460,sackOK,TS val 3416587789 ecr 2438477704,nop,wscale 9], length 0
17:05:36.300600 IP 10.0.5.3.56438 > 10.0.1.2.12345: Flags [.], ack 1, win 83, options [nop,nop,TS val 2438477707 ecr 3416587789], length 0
17:05:36.300601 IP 10.0.5.3.56438 > 10.0.1.2.12345: Flags [.], ack 1, win 83, options [nop,nop,TS val 2438477707 ecr 3416587789], length 0
17:05:36.301003 IP 10.0.1.2.12345 > 10.0.5.3.56438: Flags [P.], seq 1:17, ack 1, win 85, options [nop,nop,TS val 3416587790 ecr 2438477707], length 16
17:05:36.301004 IP 10.0.1.2.12345 > 10.0.5.3.56438: Flags [P.], seq 1:17, ack 1, win 85, options [nop,nop,TS val 3416587790 ecr 2438477707], length 16
17:05:36.301009 IP 10.0.5.3.56438 > 10.0.1.2.12345: Flags [.], ack 17, win 83, options [nop,nop,TS val 2438477708 ecr 3416587790], length 0
17:05:36.301009 IP 10.0.5.3.56438 > 10.0.1.2.12345: Flags [.], ack 17, win 83, options [nop,nop,TS val 2438477708 ecr 3416587790], length 0
17:05:36.303406 IP 10.0.5.3.56438 > 10.0.1.2.12345: Flags [P.], seq 1:4, ack 17, win 83, options [nop,nop,TS val 2438477710 ecr 3416587790], length 3
17:05:36.303409 IP 10.0.5.3.56438 > 10.0.1.2.12345: Flags [P.], seq 1:4, ack 17, win 83, options [nop,nop,TS val 2438477710 ecr 3416587790], length 3
17:05:36.303428 IP 10.0.1.2.12345 > 10.0.5.3.56438: Flags [.], ack 4, win 85, options [nop,nop,TS val 3416587792 ecr 2438477710], length 0
17:05:36.303431 IP 10.0.1.2.12345 > 10.0.5.3.56438: Flags [.], ack 4, win 85, options [nop,nop,TS val 3416587792 ecr 2438477710], length 0
17:05:36.339296 IP 10.0.1.1.12345 > 10.0.5.3.37798: Flags [.], ack 5, win 85, options [nop,nop,TS val 978132022 ecr 32348663], length 0
17:05:36.339302 IP 10.0.1.1.12345 > 10.0.5.3.37798: Flags [.], ack 5, win 85, options [nop,nop,TS val 978132022 ecr 32348663], length 0
17:05:37.285585 IP 10.0.5.2.39632 > 10.0.1.1.12345: Flags [F.], seq 4, ack 17, win 83, options [nop,nop,TS val 2100874204 ecr 226770327], length 0
17:05:37.285588 IP 10.0.5.2.39632 > 10.0.1.1.12345: Flags [F.], seq 4, ack 17, win 83, options [nop,nop,TS val 2100874204 ecr 226770327], length 0
17:05:37.285932 IP 10.0.5.2.60686 > 10.0.1.2.12345: Flags [S], seq 3665540796, win 42340, options [mss 1460,sackOK,TS val 300760418 ecr 0,nop,wscale 9], length 0
17:05:37.285955 IP 10.0.5.2.60686 > 10.0.1.2.12345: Flags [S], seq 3665540796, win 42340, options [mss 1460,sackOK,TS val 300760418 ecr 0,nop,wscale 9], length 0
17:05:37.285979 IP 10.0.1.2.12345 > 10.0.5.2.60686: Flags [S.], seq 3761558705, ack 3665540797, win 43440, options [mss 1460,sackOK,TS val 430735247 ecr 300760418,nop,wscale 9], length 0
17:05:37.286002 IP 10.0.1.2.12345 > 10.0.5.2.60686: Flags [S.], seq 3761558705, ack 3665540797, win 43440, options [mss 1460,sackOK,TS val 430735247 ecr 300760418,nop,wscale 9], length 0
17:05:37.286012 IP 10.0.5.2.60686 > 10.0.1.2.12345: Flags [.], ack 1, win 83, options [nop,nop,TS val 300760419 ecr 430735247], length 0
17:05:37.286013 IP 10.0.5.2.60686 > 10.0.1.2.12345: Flags [.], ack 1, win 83, options [nop,nop,TS val 300760419 ecr 430735247], length 0
17:05:37.286157 IP 10.0.1.2.12345 > 10.0.5.2.60686: Flags [P.], seq 1:17, ack 1, win 85, options [nop,nop,TS val 430735247 ecr 300760419], length 16
17:05:37.286158 IP 10.0.1.2.12345 > 10.0.5.2.60686: Flags [P.], seq 1:17, ack 1, win 85, options [nop,nop,TS val 430735247 ecr 300760419], length 16
17:05:37.286162 IP 10.0.5.2.60686 > 10.0.1.2.12345: Flags [.], ack 17, win 83, options [nop,nop,TS val 300760419 ecr 430735247], length 0
17:05:37.286163 IP 10.0.5.2.60686 > 10.0.1.2.12345: Flags [.], ack 17, win 83, options [nop,nop,TS val 300760419 ecr 430735247], length 0
17:05:37.286247 IP 10.0.5.2.60686 > 10.0.1.2.12345: Flags [P.], seq 1:4, ack 17, win 83, options [nop,nop,TS val 300760419 ecr 430735247], length 3
17:05:37.286248 IP 10.0.5.2.60686 > 10.0.1.2.12345: Flags [P.], seq 1:4, ack 17, win 83, options [nop,nop,TS val 300760419 ecr 430735247], length 3
17:05:37.286251 IP 10.0.1.2.12345 > 10.0.5.2.60686: Flags [.], ack 4, win 85, options [nop,nop,TS val 430735247 ecr 300760419], length 0
17:05:37.286252 IP 10.0.1.2.12345 > 10.0.5.2.60686: Flags [.], ack 4, win 85, options [nop,nop,TS val 430735247 ecr 300760419], length 0
17:05:37.304411 IP 10.0.5.3.56438 > 10.0.1.2.12345: Flags [F.], seq 4, ack 17, win 83, options [nop,nop,TS val 2438478711 ecr 3416587792], length 0
17:05:37.304420 IP 10.0.5.3.56438 > 10.0.1.2.12345: Flags [F.], seq 4, ack 17, win 83, options [nop,nop,TS val 2438478711 ecr 3416587792], length 0
17:05:37.307459 IP 10.0.5.3.51050 > 10.0.1.3.12345: Flags [S], seq 2987656485, win 42340, options [mss 1460,sackOK,TS val 2629229750 ecr 0,nop,wscale 9], length 0
17:05:37.307474 IP 10.0.5.3.51050 > 10.0.1.3.12345: Flags [S], seq 2987656485, win 42340, options [mss 1460,sackOK,TS val 2629229750 ecr 0,nop,wscale 9], length 0
17:05:37.307542 IP 10.0.1.3.12345 > 10.0.5.3.51050: Flags [S.], seq 262104973, ack 2987656486, win 43440, options [mss 1460,sackOK,TS val 3773089933 ecr 2629229750,nop,wscale 9], length 0
17:05:37.307556 IP 10.0.1.3.12345 > 10.0.5.3.51050: Flags [S.], seq 262104973, ack 2987656486, win 43440, options [mss 1460,sackOK,TS val 3773089933 ecr 2629229750,nop,wscale 9], length 0
17:05:37.307605 IP 10.0.5.3.51050 > 10.0.1.3.12345: Flags [.], ack 1, win 83, options [nop,nop,TS val 2629229753 ecr 3773089933], length 0
17:05:37.307606 IP 10.0.5.3.51050 > 10.0.1.3.12345: Flags [.], ack 1, win 83, options [nop,nop,TS val 2629229753 ecr 3773089933], length 0
17:05:37.308052 IP 10.0.1.3.12345 > 10.0.5.3.51050: Flags [P.], seq 1:17, ack 1, win 85, options [nop,nop,TS val 3773089934 ecr 2629229753], length 16
17:05:37.308054 IP 10.0.1.3.12345 > 10.0.5.3.51050: Flags [P.], seq 1:17, ack 1, win 85, options [nop,nop,TS val 3773089934 ecr 2629229753], length 16
17:05:37.308065 IP 10.0.5.3.51050 > 10.0.1.3.12345: Flags [.], ack 17, win 83, options [nop,nop,TS val 2629229754 ecr 3773089934], length 0
17:05:37.308067 IP 10.0.5.3.51050 > 10.0.1.3.12345: Flags [.], ack 17, win 83, options [nop,nop,TS val 2629229754 ecr 3773089934], length 0
17:05:37.308824 IP 10.0.5.3.51050 > 10.0.1.3.12345: Flags [P.], seq 1:4, ack 17, win 83, options [nop,nop,TS val 2629229755 ecr 3773089934], length 3
17:05:37.308827 IP 10.0.5.3.51050 > 10.0.1.3.12345: Flags [P.], seq 1:4, ack 17, win 83, options [nop,nop,TS val 2629229755 ecr 3773089934], length 3
17:05:37.308838 IP 10.0.1.3.12345 > 10.0.5.3.51050: Flags [.], ack 4, win 85, options [nop,nop,TS val 3773089935 ecr 2629229755], length 0
17:05:37.308839 IP 10.0.1.3.12345 > 10.0.5.3.51050: Flags [.], ack 4, win 85, options [nop,nop,TS val 3773089935 ecr 2629229755], length 0
17:05:37.327535 IP 10.0.1.1.12345 > 10.0.5.2.39632: Flags [.], ack 5, win 85, options [nop,nop,TS val 226771370 ecr 2100874204], length 0
17:05:37.327538 IP 10.0.1.1.12345 > 10.0.5.2.39632: Flags [.], ack 5, win 85, options [nop,nop,TS val 226771370 ecr 2100874204], length 0
17:05:37.348098 IP 10.0.1.2.12345 > 10.0.5.3.56438: Flags [.], ack 5, win 85, options [nop,nop,TS val 3416588837 ecr 2438478711], length 0
17:05:37.348101 IP 10.0.1.2.12345 > 10.0.5.3.56438: Flags [.], ack 5, win 85, options [nop,nop,TS val 3416588837 ecr 2438478711], length 0
17:05:37.511994 IP 10.0.5.1.38142 > 10.0.1.1.12345: Flags [S], seq 2520900153, win 42340, options [mss 1460,sackOK,TS val 1613789493 ecr 0,nop,wscale 9], length 0
17:05:37.512017 IP 10.0.5.1.38142 > 10.0.1.1.12345: Flags [S], seq 2520900153, win 42340, options [mss 1460,sackOK,TS val 1613789493 ecr 0,nop,wscale 9], length 0
17:05:37.512072 IP 10.0.1.1.12345 > 10.0.5.1.38142: Flags [S.], seq 793805786, ack 2520900154, win 43440, options [mss 1460,sackOK,TS val 2730805065 ecr 1613789493,nop,wscale 9], length 0
17:05:37.512086 IP 10.0.1.1.12345 > 10.0.5.1.38142: Flags [S.], seq 793805786, ack 2520900154, win 43440, options [mss 1460,sackOK,TS val 2730805065 ecr 1613789493,nop,wscale 9], length 0
17:05:37.512110 IP 10.0.5.1.38142 > 10.0.1.1.12345: Flags [.], ack 1, win 83, options [nop,nop,TS val 1613789493 ecr 2730805065], length 0
17:05:37.512111 IP 10.0.5.1.38142 > 10.0.1.1.12345: Flags [.], ack 1, win 83, options [nop,nop,TS val 1613789493 ecr 2730805065], length 0
17:05:37.601489 IP 10.0.1.1.12345 > 10.0.5.1.38142: Flags [P.], seq 1:17, ack 1, win 85, options [nop,nop,TS val 2730805154 ecr 1613789493], length 16
17:05:37.601495 IP 10.0.1.1.12345 > 10.0.5.1.38142: Flags [P.], seq 1:17, ack 1, win 85, options [nop,nop,TS val 2730805154 ecr 1613789493], length 16
17:05:37.601521 IP 10.0.5.1.38142 > 10.0.1.1.12345: Flags [.], ack 17, win 83, options [nop,nop,TS val 1613789582 ecr 2730805154], length 0
17:05:37.601523 IP 10.0.5.1.38142 > 10.0.1.1.12345: Flags [.], ack 17, win 83, options [nop,nop,TS val 1613789582 ecr 2730805154], length 0
17:05:37.604075 IP 10.0.5.1.38142 > 10.0.1.1.12345: Flags [P.], seq 1:4, ack 17, win 83, options [nop,nop,TS val 1613789585 ecr 2730805154], length 3
17:05:37.604076 IP 10.0.5.1.38142 > 10.0.1.1.12345: Flags [P.], seq 1:4, ack 17, win 83, options [nop,nop,TS val 1613789585 ecr 2730805154], length 3
17:05:37.604080 IP 10.0.1.1.12345 > 10.0.5.1.38142: Flags [.], ack 4, win 85, options [nop,nop,TS val 2730805157 ecr 1613789585], length 0
17:05:37.604081 IP 10.0.1.1.12345 > 10.0.5.1.38142: Flags [.], ack 4, win 85, options [nop,nop,TS val 2730805157 ecr 1613789585], length 0
17:05:38.287638 IP 10.0.5.2.60686 > 10.0.1.2.12345: Flags [F.], seq 4, ack 17, win 83, options [nop,nop,TS val 300761420 ecr 430735247], length 0
17:05:38.287641 IP 10.0.5.2.60686 > 10.0.1.2.12345: Flags [F.], seq 4, ack 17, win 83, options [nop,nop,TS val 300761420 ecr 430735247], length 0
17:05:38.287988 IP 10.0.5.2.58862 > 10.0.1.3.12345: Flags [S], seq 2927364786, win 42340, options [mss 1460,sackOK,TS val 3107335103 ecr 0,nop,wscale 9], length 0
17:05:38.288013 IP 10.0.5.2.58862 > 10.0.1.3.12345: Flags [S], seq 2927364786, win 42340, options [mss 1460,sackOK,TS val 3107335103 ecr 0,nop,wscale 9], length 0
17:05:38.288037 IP 10.0.1.3.12345 > 10.0.5.2.58862: Flags [S.], seq 30331866, ack 2927364787, win 43440, options [mss 1460,sackOK,TS val 3953118440 ecr 3107335103,nop,wscale 9], length 0
17:05:38.288064 IP 10.0.1.3.12345 > 10.0.5.2.58862: Flags [S.], seq 30331866, ack 2927364787, win 43440, options [mss 1460,sackOK,TS val 3953118440 ecr 3107335103,nop,wscale 9], length 0
17:05:38.288075 IP 10.0.5.2.58862 > 10.0.1.3.12345: Flags [.], ack 1, win 83, options [nop,nop,TS val 3107335104 ecr 3953118440], length 0
17:05:38.288076 IP 10.0.5.2.58862 > 10.0.1.3.12345: Flags [.], ack 1, win 83, options [nop,nop,TS val 3107335104 ecr 3953118440], length 0
17:05:38.288219 IP 10.0.1.3.12345 > 10.0.5.2.58862: Flags [P.], seq 1:17, ack 1, win 85, options [nop,nop,TS val 3953118440 ecr 3107335104], length 16
17:05:38.288220 IP 10.0.1.3.12345 > 10.0.5.2.58862: Flags [P.], seq 1:17, ack 1, win 85, options [nop,nop,TS val 3953118440 ecr 3107335104], length 16
17:05:38.288224 IP 10.0.5.2.58862 > 10.0.1.3.12345: Flags [.], ack 17, win 83, options [nop,nop,TS val 3107335104 ecr 3953118440], length 0
17:05:38.288225 IP 10.0.5.2.58862 > 10.0.1.3.12345: Flags [.], ack 17, win 83, options [nop,nop,TS val 3107335104 ecr 3953118440], length 0
17:05:38.288298 IP 10.0.5.2.58862 > 10.0.1.3.12345: Flags [P.], seq 1:4, ack 17, win 83, options [nop,nop,TS val 3107335104 ecr 3953118440], length 3
17:05:38.288299 IP 10.0.5.2.58862 > 10.0.1.3.12345: Flags [P.], seq 1:4, ack 17, win 83, options [nop,nop,TS val 3107335104 ecr 3953118440], length 3
17:05:38.288303 IP 10.0.1.3.12345 > 10.0.5.2.58862: Flags [.], ack 4, win 85, options [nop,nop,TS val 3953118440 ecr 3107335104], length 0
17:05:38.288304 IP 10.0.1.3.12345 > 10.0.5.2.58862: Flags [.], ack 4, win 85, options [nop,nop,TS val 3953118440 ecr 3107335104], length 0
17:05:38.309148 IP 10.0.5.3.51050 > 10.0.1.3.12345: Flags [F.], seq 4, ack 17, win 83, options [nop,nop,TS val 2629230755 ecr 3773089935], length 0
17:05:38.309153 IP 10.0.5.3.51050 > 10.0.1.3.12345: Flags [F.], seq 4, ack 17, win 83, options [nop,nop,TS val 2629230755 ecr 3773089935], length 0
17:05:38.312284 IP 10.0.5.3.46396 > 10.0.2.1.12345: Flags [S], seq 1135827912, win 42340, options [mss 1460,sackOK,TS val 612781951 ecr 0,nop,wscale 9], length 0
17:05:38.312296 IP 10.0.5.3.46396 > 10.0.2.1.12345: Flags [S], seq 1135827912, win 42340, options [mss 1460,sackOK,TS val 612781951 ecr 0,nop,wscale 9], length 0
17:05:38.312333 IP 10.0.2.1.12345 > 10.0.5.3.46396: Flags [S.], seq 3454989074, ack 1135827913, win 43440, options [mss 1460,sackOK,TS val 716484651 ecr 612781951,nop,wscale 9], length 0
17:05:38.312345 IP 10.0.2.1.12345 > 10.0.5.3.46396: Flags [S.], seq 3454989074, ack 1135827913, win 43440, options [mss 1460,sackOK,TS val 716484651 ecr 612781951,nop,wscale 9], length 0
17:05:38.312367 IP 10.0.5.3.46396 > 10.0.2.1.12345: Flags [.], ack 1, win 83, options [nop,nop,TS val 612781954 ecr 716484651], length 0
17:05:38.312368 IP 10.0.5.3.46396 > 10.0.2.1.12345: Flags [.], ack 1, win 83, options [nop,nop,TS val 612781954 ecr 716484651], length 0
17:05:38.312531 IP 10.0.2.1.12345 > 10.0.5.3.46396: Flags [P.], seq 1:17, ack 1, win 85, options [nop,nop,TS val 716484651 ecr 612781954], length 16
17:05:38.312532 IP 10.0.2.1.12345 > 10.0.5.3.46396: Flags [P.], seq 1:17, ack 1, win 85, options [nop,nop,TS val 716484651 ecr 612781954], length 16
17:05:38.312536 IP 10.0.5.3.46396 > 10.0.2.1.12345: Flags [.], ack 17, win 83, options [nop,nop,TS val 612781954 ecr 716484651], length 0
17:05:38.312536 IP 10.0.5.3.46396 > 10.0.2.1.12345: Flags [.], ack 17, win 83, options [nop,nop,TS val 612781954 ecr 716484651], length 0
17:05:38.312628 IP 10.0.5.3.46396 > 10.0.2.1.12345: Flags [P.], seq 1:4, ack 17, win 83, options [nop,nop,TS val 612781954 ecr 716484651], length 3
17:05:38.312629 IP 10.0.5.3.46396 > 10.0.2.1.12345: Flags [P.], seq 1:4, ack 17, win 83, options [nop,nop,TS val 612781954 ecr 716484651], length 3
17:05:38.312633 IP 10.0.2.1.12345 > 10.0.5.3.46396: Flags [.], ack 4, win 85, options [nop,nop,TS val 716484651 ecr 612781954], length 0
17:05:38.312633 IP 10.0.2.1.12345 > 10.0.5.3.46396: Flags [.], ack 4, win 85, options [nop,nop,TS val 716484651 ecr 612781954], length 0
17:05:38.331571 IP 10.0.1.2.12345 > 10.0.5.2.60686: Flags [.], ack 5, win 85, options [nop,nop,TS val 430736292 ecr 300761420], length 0
17:05:38.331575 IP 10.0.1.2.12345 > 10.0.5.2.60686: Flags [.], ack 5, win 85, options [nop,nop,TS val 430736292 ecr 300761420], length 0
17:05:38.352215 IP 10.0.1.3.12345 > 10.0.5.3.51050: Flags [.], ack 5, win 85, options [nop,nop,TS val 3773090978 ecr 2629230755], length 0
17:05:38.352223 IP 10.0.1.3.12345 > 10.0.5.3.51050: Flags [.], ack 5, win 85, options [nop,nop,TS val 3773090978 ecr 2629230755], length 0
17:05:38.605428 IP 10.0.5.1.38142 > 10.0.1.1.12345: Flags [F.], seq 4, ack 17, win 83, options [nop,nop,TS val 1613790586 ecr 2730805157], length 0
17:05:38.605432 IP 10.0.5.1.38142 > 10.0.1.1.12345: Flags [F.], seq 4, ack 17, win 83, options [nop,nop,TS val 1613790586 ecr 2730805157], length 0
17:05:38.606073 IP 10.0.5.1.58610 > 10.0.1.2.12345: Flags [S], seq 2815088170, win 42340, options [mss 1460,sackOK,TS val 522368949 ecr 0,nop,wscale 9], length 0
17:05:38.606103 IP 10.0.5.1.58610 > 10.0.1.2.12345: Flags [S], seq 2815088170, win 42340, options [mss 1460,sackOK,TS val 522368949 ecr 0,nop,wscale 9], length 0
17:05:38.606202 IP 10.0.1.2.12345 > 10.0.5.1.58610: Flags [S.], seq 1300558341, ack 2815088171, win 43440, options [mss 1460,sackOK,TS val 2314910125 ecr 522368949,nop,wscale 9], length 0
17:05:38.606228 IP 10.0.1.2.12345 > 10.0.5.1.58610: Flags [S.], seq 1300558341, ack 2815088171, win 43440, options [mss 1460,sackOK,TS val 2314910125 ecr 522368949,nop,wscale 9], length 0
17:05:38.606249 IP 10.0.5.1.58610 > 10.0.1.2.12345: Flags [.], ack 1, win 83, options [nop,nop,TS val 522368950 ecr 2314910125], length 0
17:05:38.606250 IP 10.0.5.1.58610 > 10.0.1.2.12345: Flags [.], ack 1, win 83, options [nop,nop,TS val 522368950 ecr 2314910125], length 0
17:05:38.608462 IP 10.0.4.3.36862 > 10.0.1.1.12345: Flags [S], seq 596214905, win 42340, options [mss 1460,sackOK,TS val 495531775 ecr 0,nop,wscale 9], length 0
17:05:38.608475 IP 10.0.4.3.36862 > 10.0.1.1.12345: Flags [S], seq 596214905, win 42340, options [mss 1460,sackOK,TS val 495531775 ecr 0,nop,wscale 9], length 0
17:05:38.608519 IP 10.0.1.1.12345 > 10.0.4.3.36862: Flags [S.], seq 2185542797, ack 596214906, win 43440, options [mss 1460,sackOK,TS val 2901032174 ecr 495531775,nop,wscale 9], length 0
17:05:38.608533 IP 10.0.1.1.12345 > 10.0.4.3.36862: Flags [S.], seq 2185542797, ack 596214906, win 43440, options [mss 1460,sackOK,TS val 2901032174 ecr 495531775,nop,wscale 9], length 0
17:05:38.608557 IP 10.0.4.3.36862 > 10.0.1.1.12345: Flags [.], ack 1, win 83, options [nop,nop,TS val 495531775 ecr 2901032174], length 0
17:05:38.608558 IP 10.0.4.3.36862 > 10.0.1.1.12345: Flags [.], ack 1, win 83, options [nop,nop,TS val 495531775 ecr 2901032174], length 0
17:05:38.647263 IP 10.0.1.1.12345 > 10.0.5.1.38142: Flags [.], ack 5, win 85, options [nop,nop,TS val 2730806200 ecr 1613790586], length 0
17:05:38.647267 IP 10.0.1.1.12345 > 10.0.5.1.38142: Flags [.], ack 5, win 85, options [nop,nop,TS val 2730806200 ecr 1613790586], length 0
17:05:38.679948 IP 10.0.1.2.12345 > 10.0.5.1.58610: Flags [P.], seq 1:17, ack 1, win 85, options [nop,nop,TS val 2314910199 ecr 522368950], length 16
17:05:38.679984 IP 10.0.1.2.12345 > 10.0.5.1.58610: Flags [P.], seq 1:17, ack 1, win 85, options [nop,nop,TS val 2314910199 ecr 522368950], length 16
17:05:38.680072 IP 10.0.5.1.58610 > 10.0.1.2.12345: Flags [.], ack 17, win 83, options [nop,nop,TS val 522369024 ecr 2314910199], length 0
17:05:38.680075 IP 10.0.5.1.58610 > 10.0.1.2.12345: Flags [.], ack 17, win 83, options [nop,nop,TS val 522369024 ecr 2314910199], length 0
17:05:38.680510 IP 10.0.5.1.58610 > 10.0.1.2.12345: Flags [P.], seq 1:4, ack 17, win 83, options [nop,nop,TS val 522369024 ecr 2314910199], length 3
17:05:38.680512 IP 10.0.5.1.58610 > 10.0.1.2.12345: Flags [P.], seq 1:4, ack 17, win 83, options [nop,nop,TS val 522369024 ecr 2314910199], length 3
17:05:38.680528 IP 10.0.1.2.12345 > 10.0.5.1.58610: Flags [.], ack 4, win 85, options [nop,nop,TS val 2314910199 ecr 522369024], length 0
17:05:38.680530 IP 10.0.1.2.12345 > 10.0.5.1.58610: Flags [.], ack 4, win 85, options [nop,nop,TS val 2314910199 ecr 522369024], length 0
17:05:38.819250 IP 10.0.1.1.12345 > 10.0.4.3.36862: Flags [P.], seq 1:17, ack 1, win 85, options [nop,nop,TS val 2901032385 ecr 495531775], length 16
17:05:38.819256 IP 10.0.1.1.12345 > 10.0.4.3.36862: Flags [P.], seq 1:17, ack 1, win 85, options [nop,nop,TS val 2901032385 ecr 495531775], length 16
17:05:38.819280 IP 10.0.4.3.36862 > 10.0.1.1.12345: Flags [.], ack 17, win 83, options [nop,nop,TS val 495531986 ecr 2901032385], length 0
17:05:38.819282 IP 10.0.4.3.36862 > 10.0.1.1.12345: Flags [.], ack 17, win 83, options [nop,nop,TS val 495531986 ecr 2901032385], length 0
17:05:38.823763 IP 10.0.4.3.36862 > 10.0.1.1.12345: Flags [P.], seq 1:4, ack 17, win 83, options [nop,nop,TS val 495531990 ecr 2901032385], length 3
17:05:38.823767 IP 10.0.4.3.36862 > 10.0.1.1.12345: Flags [P.], seq 1:4, ack 17, win 83, options [nop,nop,TS val 495531990 ecr 2901032385], length 3
17:05:38.823784 IP 10.0.1.1.12345 > 10.0.4.3.36862: Flags [.], ack 4, win 85, options [nop,nop,TS val 2901032389 ecr 495531990], length 0
17:05:38.823787 IP 10.0.1.1.12345 > 10.0.4.3.36862: Flags [.], ack 4, win 85, options [nop,nop,TS val 2901032389 ecr 495531990], length 0
17:05:39.288979 IP 10.0.5.2.58862 > 10.0.1.3.12345: Flags [F.], seq 4, ack 17, win 83, options [nop,nop,TS val 3107336105 ecr 3953118440], length 0
17:05:39.288985 IP 10.0.5.2.58862 > 10.0.1.3.12345: Flags [F.], seq 4, ack 17, win 83, options [nop,nop,TS val 3107336105 ecr 3953118440], length 0
17:05:39.289468 IP 10.0.5.2.54702 > 10.0.2.1.12345: Flags [S], seq 746738017, win 42340, options [mss 1460,sackOK,TS val 3632559832 ecr 0,nop,wscale 9], length 0
17:05:39.289498 IP 10.0.5.2.54702 > 10.0.2.1.12345: Flags [S], seq 746738017, win 42340, options [mss 1460,sackOK,TS val 3632559832 ecr 0,nop,wscale 9], length 0
17:05:39.289522 IP 10.0.2.1.12345 > 10.0.5.2.54702: Flags [S.], seq 1091291020, ack 746738018, win 43440, options [mss 1460,sackOK,TS val 3885419379 ecr 3632559832,nop,wscale 9], length 0
17:05:39.289546 IP 10.0.2.1.12345 > 10.0.5.2.54702: Flags [S.], seq 1091291020, ack 746738018, win 43440, options [mss 1460,sackOK,TS val 3885419379 ecr 3632559832,nop,wscale 9], length 0
17:05:39.289556 IP 10.0.5.2.54702 > 10.0.2.1.12345: Flags [.], ack 1, win 83, options [nop,nop,TS val 3632559832 ecr 3885419379], length 0
17:05:39.289557 IP 10.0.5.2.54702 > 10.0.2.1.12345: Flags [.], ack 1, win 83, options [nop,nop,TS val 3632559832 ecr 3885419379], length 0
17:05:39.289654 IP 10.0.2.1.12345 > 10.0.5.2.54702: Flags [P.], seq 1:17, ack 1, win 85, options [nop,nop,TS val 3885419379 ecr 3632559832], length 16
17:05:39.289655 IP 10.0.2.1.12345 > 10.0.5.2.54702: Flags [P.], seq 1:17, ack 1, win 85, options [nop,nop,TS val 3885419379 ecr 3632559832], length 16
17:05:39.289658 IP 10.0.5.2.54702 > 10.0.2.1.12345: Flags [.], ack 17, win 83, options [nop,nop,TS val 3632559832 ecr 3885419379], length 0
17:05:39.289659 IP 10.0.5.2.54702 > 10.0.2.1.12345: Flags [.], ack 17, win 83, options [nop,nop,TS val 3632559832 ecr 3885419379], length 0
17:05:39.289884 IP 10.0.5.2.54702 > 10.0.2.1.12345: Flags [P.], seq 1:4, ack 17, win 83, options [nop,nop,TS val 3632559833 ecr 3885419379], length 3
17:05:39.289887 IP 10.0.5.2.54702 > 10.0.2.1.12345: Flags [P.], seq 1:4, ack 17, win 83, options [nop,nop,TS val 3632559833 ecr 3885419379], length 3
17:05:39.289892 IP 10.0.2.1.12345 > 10.0.5.2.54702: Flags [.], ack 4, win 85, options [nop,nop,TS val 3885419380 ecr 3632559833], length 0
17:05:39.289893 IP 10.0.2.1.12345 > 10.0.5.2.54702: Flags [.], ack 4, win 85, options [nop,nop,TS val 3885419380 ecr 3632559833], length 0
17:05:39.313388 IP 10.0.5.3.46396 > 10.0.2.1.12345: Flags [F.], seq 4, ack 17, win 83, options [nop,nop,TS val 612782955 ecr 716484651], length 0
17:05:39.313392 IP 10.0.5.3.46396 > 10.0.2.1.12345: Flags [F.], seq 4, ack 17, win 83, options [nop,nop,TS val 612782955 ecr 716484651], length 0
17:05:39.316376 IP 10.0.5.3.41942 > 10.0.2.2.12345: Flags [S], seq 1367986623, win 42340, options [mss 1460,sackOK,TS val 2809685215 ecr 0,nop,wscale 9], length 0
17:05:39.316388 IP 10.0.5.3.41942 > 10.0.2.2.12345: Flags [S], seq 1367986623, win 42340, options [mss 1460,sackOK,TS val 2809685215 ecr 0,nop,wscale 9], length 0
17:05:39.316426 IP 10.0.2.2.12345 > 10.0.5.3.41942: Flags [S.], seq 2323867657, ack 1367986624, win 43440, options [mss 1460,sackOK,TS val 806553523 ecr 2809685215,nop,wscale 9], length 0
17:05:39.316438 IP 10.0.2.2.12345 > 10.0.5.3.41942: Flags [S.], seq 2323867657, ack 1367986624, win 43440, options [mss 1460,sackOK,TS val 806553523 ecr 2809685215,nop,wscale 9], length 0
17:05:39.316465 IP 10.0.5.3.41942 > 10.0.2.2.12345: Flags [.], ack 1, win 83, options [nop,nop,TS val 2809685218 ecr 806553523], length 0
17:05:39.316466 IP 10.0.5.3.41942 > 10.0.2.2.12345: Flags [.], ack 1, win 83, options [nop,nop,TS val 2809685218 ecr 806553523], length 0
17:05:39.316633 IP 10.0.2.2.12345 > 10.0.5.3.41942: Flags [P.], seq 1:17, ack 1, win 85, options [nop,nop,TS val 806553523 ecr 2809685218], length 16
17:05:39.316634 IP 10.0.2.2.12345 > 10.0.5.3.41942: Flags [P.], seq 1:17, ack 1, win 85, options [nop,nop,TS val 806553523 ecr 2809685218], length 16
17:05:39.316638 IP 10.0.5.3.41942 > 10.0.2.2.12345: Flags [.], ack 17, win 83, options [nop,nop,TS val 2809685218 ecr 806553523], length 0
17:05:39.316639 IP 10.0.5.3.41942 > 10.0.2.2.12345: Flags [.], ack 17, win 83, options [nop,nop,TS val 2809685218 ecr 806553523], length 0
17:05:39.316724 IP 10.0.5.3.41942 > 10.0.2.2.12345: Flags [P.], seq 1:4, ack 17, win 83, options [nop,nop,TS val 2809685218 ecr 806553523], length 3
17:05:39.316725 IP 10.0.5.3.41942 > 10.0.2.2.12345: Flags [P.], seq 1:4, ack 17, win 83, options [nop,nop,TS val 2809685218 ecr 806553523], length 3
17:05:39.316729 IP 10.0.2.2.12345 > 10.0.5.3.41942: Flags [.], ack 4, win 85, options [nop,nop,TS val 806553523 ecr 2809685218], length 0
17:05:39.316729 IP 10.0.2.2.12345 > 10.0.5.3.41942: Flags [.], ack 4, win 85, options [nop,nop,TS val 806553523 ecr 2809685218], length 0
17:05:39.331775 IP 10.0.1.3.12345 > 10.0.5.2.58862: Flags [.], ack 5, win 85, options [nop,nop,TS val 3953119483 ecr 3107336105], length 0
17:05:39.331778 IP 10.0.1.3.12345 > 10.0.5.2.58862: Flags [.], ack 5, win 85, options [nop,nop,TS val 3953119483 ecr 3107336105], length 0
17:05:39.355377 IP 10.0.2.1.12345 > 10.0.5.3.46396: Flags [.], ack 5, win 85, options [nop,nop,TS val 716485694 ecr 612782955], length 0
17:05:39.355381 IP 10.0.2.1.12345 > 10.0.5.3.46396: Flags [.], ack 5, win 85, options [nop,nop,TS val 716485694 ecr 612782955], length 0
17:05:39.681590 IP 10.0.5.1.58610 > 10.0.1.2.12345: Flags [F.], seq 4, ack 17, win 83, options [nop,nop,TS val 522370025 ecr 2314910199], length 0
17:05:39.681594 IP 10.0.5.1.58610 > 10.0.1.2.12345: Flags [F.], seq 4, ack 17, win 83, options [nop,nop,TS val 522370025 ecr 2314910199], length 0
17:05:39.681972 IP 10.0.5.1.43260 > 10.0.1.3.12345: Flags [S], seq 4127565829, win 42340, options [mss 1460,sackOK,TS val 3362069335 ecr 0,nop,wscale 9], length 0
17:05:39.681996 IP 10.0.5.1.43260 > 10.0.1.3.12345: Flags [S], seq 4127565829, win 42340, options [mss 1460,sackOK,TS val 3362069335 ecr 0,nop,wscale 9], length 0
17:05:39.682020 IP 10.0.1.3.12345 > 10.0.5.1.43260: Flags [S.], seq 202135542, ack 4127565830, win 43440, options [mss 1460,sackOK,TS val 3367189023 ecr 3362069335,nop,wscale 9], length 0
17:05:39.682044 IP 10.0.1.3.12345 > 10.0.5.1.43260: Flags [S.], seq 202135542, ack 4127565830, win 43440, options [mss 1460,sackOK,TS val 3367189023 ecr 3362069335,nop,wscale 9], length 0
17:05:39.682054 IP 10.0.5.1.43260 > 10.0.1.3.12345: Flags [.], ack 1, win 83, options [nop,nop,TS val 3362069336 ecr 3367189023], length 0
17:05:39.682055 IP 10.0.5.1.43260 > 10.0.1.3.12345: Flags [.], ack 1, win 83, options [nop,nop,TS val 3362069336 ecr 3367189023], length 0
17:05:39.723665 IP 10.0.1.2.12345 > 10.0.5.1.58610: Flags [.], ack 5, win 85, options [nop,nop,TS val 2314911242 ecr 522370025], length 0
17:05:39.723676 IP 10.0.1.2.12345 > 10.0.5.1.58610: Flags [.], ack 5, win 85, options [nop,nop,TS val 2314911242 ecr 522370025], length 0
17:05:39.723970 IP 10.0.1.3.12345 > 10.0.5.1.43260: Flags [P.], seq 1:17, ack 1, win 85, options [nop,nop,TS val 3367189065 ecr 3362069336], length 16
17:05:39.723971 IP 10.0.1.3.12345 > 10.0.5.1.43260: Flags [P.], seq 1:17, ack 1, win 85, options [nop,nop,TS val 3367189065 ecr 3362069336], length 16
17:05:39.723981 IP 10.0.5.1.43260 > 10.0.1.3.12345: Flags [.], ack 17, win 83, options [nop,nop,TS val 3362069378 ecr 3367189065], length 0
17:05:39.723983 IP 10.0.5.1.43260 > 10.0.1.3.12345: Flags [.], ack 17, win 83, options [nop,nop,TS val 3362069378 ecr 3367189065], length 0
17:05:39.727503 IP 10.0.5.1.43260 > 10.0.1.3.12345: Flags [P.], seq 1:4, ack 17, win 83, options [nop,nop,TS val 3362069381 ecr 3367189065], length 3
17:05:39.727504 IP 10.0.5.1.43260 > 10.0.1.3.12345: Flags [P.], seq 1:4, ack 17, win 83, options [nop,nop,TS val 3362069381 ecr 3367189065], length 3
17:05:39.727507 IP 10.0.1.3.12345 > 10.0.5.1.43260: Flags [.], ack 4, win 85, options [nop,nop,TS val 3367189068 ecr 3362069381], length 0
17:05:39.727508 IP 10.0.1.3.12345 > 10.0.5.1.43260: Flags [.], ack 4, win 85, options [nop,nop,TS val 3367189068 ecr 3362069381], length 0
17:05:39.824267 IP 10.0.4.3.36862 > 10.0.1.1.12345: Flags [F.], seq 4, ack 17, win 83, options [nop,nop,TS val 495532991 ecr 2901032389], length 0
17:05:39.824271 IP 10.0.4.3.36862 > 10.0.1.1.12345: Flags [F.], seq 4, ack 17, win 83, options [nop,nop,TS val 495532991 ecr 2901032389], length 0
17:05:39.824793 IP 10.0.4.3.43770 > 10.0.1.2.12345: Flags [S], seq 2694746007, win 42340, options [mss 1460,sackOK,TS val 2938999545 ecr 0,nop,wscale 9], length 0
17:05:39.824807 IP 10.0.4.3.43770 > 10.0.1.2.12345: Flags [S], seq 2694746007, win 42340, options [mss 1460,sackOK,TS val 2938999545 ecr 0,nop,wscale 9], length 0
17:05:39.824858 IP 10.0.1.2.12345 > 10.0.4.3.43770: Flags [S.], seq 2229046686, ack 2694746008, win 43440, options [mss 1460,sackOK,TS val 219176811 ecr 2938999545,nop,wscale 9], length 0
17:05:39.824872 IP 10.0.1.2.12345 > 10.0.4.3.43770: Flags [S.], seq 2229046686, ack 2694746008, win 43440, options [mss 1460,sackOK,TS val 219176811 ecr 2938999545,nop,wscale 9], length 0
17:05:39.824903 IP 10.0.4.3.43770 > 10.0.1.2.12345: Flags [.], ack 1, win 83, options [nop,nop,TS val 2938999546 ecr 219176811], length 0
17:05:39.824905 IP 10.0.4.3.43770 > 10.0.1.2.12345: Flags [.], ack 1, win 83, options [nop,nop,TS val 2938999546 ecr 219176811], length 0
17:05:39.867225 IP 10.0.1.1.12345 > 10.0.4.3.36862: Flags [.], ack 5, win 85, options [nop,nop,TS val 2901033433 ecr 495532991], length 0
17:05:39.867228 IP 10.0.1.1.12345 > 10.0.4.3.36862: Flags [.], ack 5, win 85, options [nop,nop,TS val 2901033433 ecr 495532991], length 0
17:05:39.874719 IP 10.0.1.2.12345 > 10.0.4.3.43770: Flags [P.], seq 1:17, ack 1, win 85, options [nop,nop,TS val 219176860 ecr 2938999546], length 16
17:05:39.874730 IP 10.0.1.2.12345 > 10.0.4.3.43770: Flags [P.], seq 1:17, ack 1, win 85, options [nop,nop,TS val 219176860 ecr 2938999546], length 16
17:05:39.874783 IP 10.0.4.3.43770 > 10.0.1.2.12345: Flags [.], ack 17, win 83, options [nop,nop,TS val 2938999595 ecr 219176860], length 0
17:05:39.874786 IP 10.0.4.3.43770 > 10.0.1.2.12345: Flags [.], ack 17, win 83, options [nop,nop,TS val 2938999595 ecr 219176860], length 0
17:05:39.876150 IP 10.0.4.3.43770 > 10.0.1.2.12345: Flags [P.], seq 1:4, ack 17, win 83, options [nop,nop,TS val 2938999597 ecr 219176860], length 3
17:05:39.876154 IP 10.0.4.3.43770 > 10.0.1.2.12345: Flags [P.], seq 1:4, ack 17, win 83, options [nop,nop,TS val 2938999597 ecr 219176860], length 3
17:05:39.876167 IP 10.0.1.2.12345 > 10.0.4.3.43770: Flags [.], ack 4, win 85, options [nop,nop,TS val 219176862 ecr 2938999597], length 0
17:05:39.876170 IP 10.0.1.2.12345 > 10.0.4.3.43770: Flags [.], ack 4, win 85, options [nop,nop,TS val 219176862 ecr 2938999597], length 0
17:05:40.255045 IP 10.0.4.2.45514 > 10.0.1.1.12345: Flags [S], seq 1989041283, win 42340, options [mss 1460,sackOK,TS val 2145927246 ecr 0,nop,wscale 9], length 0
17:05:40.255071 IP 10.0.4.2.45514 > 10.0.1.1.12345: Flags [S], seq 1989041283, win 42340, options [mss 1460,sackOK,TS val 2145927246 ecr 0,nop,wscale 9], length 0
17:05:40.255106 IP 10.0.1.1.12345 > 10.0.4.2.45514: Flags [S.], seq 1184974905, ack 1989041284, win 43440, options [mss 1460,sackOK,TS val 1791295932 ecr 2145927246,nop,wscale 9], length 0
17:05:40.255134 IP 10.0.1.1.12345 > 10.0.4.2.45514: Flags [S.], seq 1184974905, ack 1989041284, win 43440, options [mss 1460,sackOK,TS val 1791295932 ecr 2145927246,nop,wscale 9], length 0
17:05:40.255162 IP 10.0.4.2.45514 > 10.0.1.1.12345: Flags [.], ack 1, win 83, options [nop,nop,TS val 2145927247 ecr 1791295932], length 0
17:05:40.255164 IP 10.0.4.2.45514 > 10.0.1.1.12345: Flags [.], ack 1, win 83, options [nop,nop,TS val 2145927247 ecr 1791295932], length 0
17:05:40.269488 IP 10.0.1.1.12345 > 10.0.4.2.45514: Flags [P.], seq 1:17, ack 1, win 85, options [nop,nop,TS val 1791295946 ecr 2145927247], length 16
17:05:40.269493 IP 10.0.1.1.12345 > 10.0.4.2.45514: Flags [P.], seq 1:17, ack 1, win 85, options [nop,nop,TS val 1791295946 ecr 2145927247], length 16
17:05:40.269515 IP 10.0.4.2.45514 > 10.0.1.1.12345: Flags [.], ack 17, win 83, options [nop,nop,TS val 2145927261 ecr 1791295946], length 0
17:05:40.269517 IP 10.0.4.2.45514 > 10.0.1.1.12345: Flags [.], ack 17, win 83, options [nop,nop,TS val 2145927261 ecr 1791295946], length 0
17:05:40.272024 IP 10.0.4.2.45514 > 10.0.1.1.12345: Flags [P.], seq 1:4, ack 17, win 83, options [nop,nop,TS val 2145927264 ecr 1791295946], length 3
17:05:40.272025 IP 10.0.4.2.45514 > 10.0.1.1.12345: Flags [P.], seq 1:4, ack 17, win 83, options [nop,nop,TS val 2145927264 ecr 1791295946], length 3
17:05:40.272030 IP 10.0.1.1.12345 > 10.0.4.2.45514: Flags [.], ack 4, win 85, options [nop,nop,TS val 1791295949 ecr 2145927264], length 0
17:05:40.272032 IP 10.0.1.1.12345 > 10.0.4.2.45514: Flags [.], ack 4, win 85, options [nop,nop,TS val 1791295949 ecr 2145927264], length 0
17:05:40.290863 IP 10.0.5.2.54702 > 10.0.2.1.12345: Flags [F.], seq 4, ack 17, win 83, options [nop,nop,TS val 3632560834 ecr 3885419380], length 0
17:05:40.290867 IP 10.0.5.2.54702 > 10.0.2.1.12345: Flags [F.], seq 4, ack 17, win 83, options [nop,nop,TS val 3632560834 ecr 3885419380], length 0
17:05:40.291411 IP 10.0.5.2.57568 > 10.0.2.2.12345: Flags [S], seq 2510453120, win 42340, options [mss 1460,sackOK,TS val 3346626928 ecr 0,nop,wscale 9], length 0
17:05:40.291428 IP 10.0.5.2.57568 > 10.0.2.2.12345: Flags [S], seq 2510453120, win 42340, options [mss 1460,sackOK,TS val 3346626928 ecr 0,nop,wscale 9], length 0
17:05:40.291479 IP 10.0.2.2.12345 > 10.0.5.2.57568: Flags [S.], seq 3004155752, ack 2510453121, win 43440, options [mss 1460,sackOK,TS val 1093407514 ecr 3346626928,nop,wscale 9], length 0
17:05:40.291568 IP 10.0.2.2.12345 > 10.0.5.2.57568: Flags [S.], seq 3004155752, ack 2510453121, win 43440, options [mss 1460,sackOK,TS val 1093407514 ecr 3346626928,nop,wscale 9], length 0
17:05:40.291595 IP 10.0.5.2.57568 > 10.0.2.2.12345: Flags [.], ack 1, win 83, options [nop,nop,TS val 3346626928 ecr 1093407514], length 0
17:05:40.291597 IP 10.0.5.2.57568 > 10.0.2.2.12345: Flags [.], ack 1, win 83, options [nop,nop,TS val 3346626928 ecr 1093407514], length 0
17:05:40.292395 IP 10.0.2.2.12345 > 10.0.5.2.57568: Flags [P.], seq 1:17, ack 1, win 85, options [nop,nop,TS val 1093407515 ecr 3346626928], length 16
17:05:40.292396 IP 10.0.2.2.12345 > 10.0.5.2.57568: Flags [P.], seq 1:17, ack 1, win 85, options [nop,nop,TS val 1093407515 ecr 3346626928], length 16
17:05:40.292403 IP 10.0.5.2.57568 > 10.0.2.2.12345: Flags [.], ack 17, win 83, options [nop,nop,TS val 3346626929 ecr 1093407515], length 0
17:05:40.292403 IP 10.0.5.2.57568 > 10.0.2.2.12345: Flags [.], ack 17, win 83, options [nop,nop,TS val 3346626929 ecr 1093407515], length 0
17:05:40.292712 IP 10.0.5.2.57568 > 10.0.2.2.12345: Flags [P.], seq 1:4, ack 17, win 83, options [nop,nop,TS val 3346626929 ecr 1093407515], length 3
17:05:40.292713 IP 10.0.5.2.57568 > 10.0.2.2.12345: Flags [P.], seq 1:4, ack 17, win 83, options [nop,nop,TS val 3346626929 ecr 1093407515], length 3
17:05:40.292719 IP 10.0.2.2.12345 > 10.0.5.2.57568: Flags [.], ack 4, win 85, options [nop,nop,TS val 1093407515 ecr 3346626929], length 0
