17:05:35.295457 ARP, Request who-has 10.0.1.1 tell 10.0.5.3, length 28
17:05:35.295564 ARP, Request who-has 10.0.1.1 tell 10.0.5.3, length 28
17:05:35.295565 ARP, Request who-has 10.0.1.1 tell 10.0.5.3, length 28
17:05:35.295566 ARP, Request who-has 10.0.1.1 tell 10.0.5.3, length 28
17:05:35.295571 ARP, Request who-has 10.0.1.1 tell 10.0.5.3, length 28
17:05:35.295605 ARP, Request who-has 10.0.1.1 tell 10.0.5.3, length 28
17:05:35.295606 ARP, Request who-has 10.0.1.1 tell 10.0.5.3, length 28
17:05:35.295608 ARP, Request who-has 10.0.1.1 tell 10.0.5.3, length 28
17:05:35.295609 ARP, Request who-has 10.0.1.1 tell 10.0.5.3, length 28
17:05:35.295609 ARP, Request who-has 10.0.1.1 tell 10.0.5.3, length 28
17:05:35.295611 ARP, Request who-has 10.0.1.1 tell 10.0.5.3, length 28
17:05:35.295613 ARP, Request who-has 10.0.1.1 tell 10.0.5.3, length 28
17:05:35.295615 ARP, Request who-has 10.0.1.1 tell 10.0.5.3, length 28
17:05:35.295656 ARP, Request who-has 10.0.1.1 tell 10.0.5.3, length 28
17:05:35.295658 ARP, Request who-has 10.0.1.1 tell 10.0.5.3, length 28
17:05:35.295659 ARP, Request who-has 10.0.1.1 tell 10.0.5.3, length 28
17:05:35.295667 ARP, Request who-has 10.0.1.1 tell 10.0.5.3, length 28
17:05:35.295668 ARP, Request who-has 10.0.1.1 tell 10.0.5.3, length 28
17:05:35.295669 ARP, Request who-has 10.0.1.1 tell 10.0.5.3, length 28
17:05:35.295681 ARP, Reply 10.0.1.1 is-at 4a:af:d0:53:c7:a1, length 28
17:05:35.295686 ARP, Request who-has 10.0.1.1 tell 10.0.5.3, length 28
17:05:35.295687 ARP, Request who-has 10.0.1.1 tell 10.0.5.3, length 28
17:05:35.295688 ARP, Request who-has 10.0.1.1 tell 10.0.5.3, length 28
17:05:35.295695 ARP, Request who-has 10.0.1.1 tell 10.0.5.3, length 28
17:05:35.295697 ARP, Request who-has 10.0.1.1 tell 10.0.5.3, length 28
17:05:35.295697 ARP, Request who-has 10.0.1.1 tell 10.0.5.3, length 28
17:05:35.295716 ARP, Reply 10.0.1.1 is-at 4a:af:d0:53:c7:a1, length 28
17:05:35.295716 ARP, Reply 10.0.1.1 is-at 4a:af:d0:53:c7:a1, length 28
17:05:35.295729 ARP, Reply 10.0.1.1 is-at 4a:af:d0:53:c7:a1, length 28
17:05:35.295730 ARP, Reply 10.0.1.1 is-at 4a:af:d0:53:c7:a1, length 28
17:05:35.295742 ARP, Reply 10.0.1.1 is-at 4a:af:d0:53:c7:a1, length 28
17:05:35.295745 IP 10.0.5.3.37798 > 10.0.1.1.12345: Flags [S], seq 139480223, win 42340, options [mss 1460,sackOK,TS val 32347661 ecr 0,nop,wscale 9], length 0
17:05:35.295759 IP 10.0.5.3.37798 > 10.0.1.1.12345: Flags [S], seq 139480223, win 42340, options [mss 1460,sackOK,TS val 32347661 ecr 0,nop,wscale 9], length 0
17:05:35.295759 IP 10.0.5.3.37798 > 10.0.1.1.12345: Flags [S], seq 139480223, win 42340, options [mss 1460,sackOK,TS val 32347661 ecr 0,nop,wscale 9], length 0
17:05:35.295771 IP 10.0.5.3.37798 > 10.0.1.1.12345: Flags [S], seq 139480223, win 42340, options [mss 1460,sackOK,TS val 32347661 ecr 0,nop,wscale 9], length 0
17:05:35.295772 IP 10.0.5.3.37798 > 10.0.1.1.12345: Flags [S], seq 139480223, win 42340, options [mss 1460,sackOK,TS val 32347661 ecr 0,nop,wscale 9], length 0
17:05:35.295783 IP 10.0.5.3.37798 > 10.0.1.1.12345: Flags [S], seq 139480223, win 42340, options [mss 1460,sackOK,TS val 32347661 ecr 0,nop,wscale 9], length 0
17:05:35.295796 IP 10.0.1.1.12345 > 10.0.5.3.37798: Flags [S.], seq 4206956474, ack 139480224, win 43440, options [mss 1460,sackOK,TS val 978130979 ecr 32347661,nop,wscale 9], length 0
17:05:35.295810 IP 10.0.1.1.12345 > 10.0.5.3.37798: Flags [S.], seq 4206956474, ack 139480224, win 43440, options [mss 1460,sackOK,TS val 978130979 ecr 32347661,nop,wscale 9], length 0
17:05:35.295810 IP 10.0.1.1.12345 > 10.0.5.3.37798: Flags [S.], seq 4206956474, ack 139480224, win 43440, options [mss 1460,sackOK,TS val 978130979 ecr 32347661,nop,wscale 9], length 0
17:05:35.295821 IP 10.0.1.1.12345 > 10.0.5.3.37798: Flags [S.], seq 4206956474, ack 139480224, win 43440, options [mss 1460,sackOK,TS val 978130979 ecr 32347661,nop,wscale 9], length 0
17:05:35.295822 IP 10.0.1.1.12345 > 10.0.5.3.37798: Flags [S.], seq 4206956474, ack 139480224, win 43440, options [mss 1460,sackOK,TS val 978130979 ecr 32347661,nop,wscale 9], length 0
17:05:35.295833 IP 10.0.1.1.12345 > 10.0.5.3.37798: Flags [S.], seq 4206956474, ack 139480224, win 43440, options [mss 1460,sackOK,TS val 978130979 ecr 32347661,nop,wscale 9], length 0
17:05:35.295844 IP 10.0.5.3.37798 > 10.0.1.1.12345: Flags [.], ack 1, win 83, options [nop,nop,TS val 32347662 ecr 978130979], length 0
17:05:35.295885 IP 10.0.5.3.37798 > 10.0.1.1.12345: Flags [.], ack 1, win 83, options [nop,nop,TS val 32347662 ecr 978130979], length 0
17:05:35.295885 IP 10.0.5.3.37798 > 10.0.1.1.12345: Flags [.], ack 1, win 83, options [nop,nop,TS val 32347662 ecr 978130979], length 0
17:05:35.295886 IP 10.0.5.3.37798 > 10.0.1.1.12345: Flags [.], ack 1, win 83, options [nop,nop,TS val 32347662 ecr 978130979], length 0
17:05:35.295886 IP 10.0.5.3.37798 > 10.0.1.1.12345: Flags [.], ack 1, win 83, options [nop,nop,TS val 32347662 ecr 978130979], length 0
17:05:35.295887 IP 10.0.5.3.37798 > 10.0.1.1.12345: Flags [.], ack 1, win 83, options [nop,nop,TS val 32347662 ecr 978130979], length 0
17:05:35.296016 IP 10.0.1.1.12345 > 10.0.5.3.37798: Flags [P.], seq 1:17, ack 1, win 85, options [nop,nop,TS val 978130979 ecr 32347662], length 16
17:05:35.296017 IP 10.0.1.1.12345 > 10.0.5.3.37798: Flags [P.], seq 1:17, ack 1, win 85, options [nop,nop,TS val 978130979 ecr 32347662], length 16
17:05:35.296018 IP 10.0.1.1.12345 > 10.0.5.3.37798: Flags [P.], seq 1:17, ack 1, win 85, options [nop,nop,TS val 978130979 ecr 32347662], length 16
17:05:35.296018 IP 10.0.1.1.12345 > 10.0.5.3.37798: Flags [P.], seq 1:17, ack 1, win 85, options [nop,nop,TS val 978130979 ecr 32347662], length 16
17:05:35.296018 IP 10.0.1.1.12345 > 10.0.5.3.37798: Flags [P.], seq 1:17, ack 1, win 85, options [nop,nop,TS val 978130979 ecr 32347662], length 16
17:05:35.296019 IP 10.0.1.1.12345 > 10.0.5.3.37798: Flags [P.], seq 1:17, ack 1, win 85, options [nop,nop,TS val 978130979 ecr 32347662], length 16
17:05:35.296023 IP 10.0.5.3.37798 > 10.0.1.1.12345: Flags [.], ack 17, win 83, options [nop,nop,TS val 32347662 ecr 978130979], length 0
17:05:35.296023 IP 10.0.5.3.37798 > 10.0.1.1.12345: Flags [.], ack 17, win 83, options [nop,nop,TS val 32347662 ecr 978130979], length 0
17:05:35.296023 IP 10.0.5.3.37798 > 10.0.1.1.12345: Flags [.], ack 17, win 83, options [nop,nop,TS val 32347662 ecr 978130979], length 0
17:05:35.296024 IP 10.0.5.3.37798 > 10.0.1.1.12345: Flags [.], ack 17, win 83, options [nop,nop,TS val 32347662 ecr 978130979], length 0
17:05:35.296024 IP 10.0.5.3.37798 > 10.0.1.1.12345: Flags [.], ack 17, win 83, options [nop,nop,TS val 32347662 ecr 978130979], length 0
17:05:35.296024 IP 10.0.5.3.37798 > 10.0.1.1.12345: Flags [.], ack 17, win 83, options [nop,nop,TS val 32347662 ecr 978130979], length 0
17:05:35.296292 IP 10.0.5.3.37798 > 10.0.1.1.12345: Flags [P.], seq 1:4, ack 17, win 83, options [nop,nop,TS val 32347662 ecr 978130979], length 3
17:05:35.296293 IP 10.0.5.3.37798 > 10.0.1.1.12345: Flags [P.], seq 1:4, ack 17, win 83, options [nop,nop,TS val 32347662 ecr 978130979], length 3
17:05:35.296293 IP 10.0.5.3.37798 > 10.0.1.1.12345: Flags [P.], seq 1:4, ack 17, win 83, options [nop,nop,TS val 32347662 ecr 978130979], length 3
17:05:35.296293 IP 10.0.5.3.37798 > 10.0.1.1.12345: Flags [P.], seq 1:4, ack 17, win 83, options [nop,nop,TS val 32347662 ecr 978130979], length 3
17:05:35.296293 IP 10.0.5.3.37798 > 10.0.1.1.12345: Flags [P.], seq 1:4, ack 17, win 83, options [nop,nop,TS val 32347662 ecr 978130979], length 3
17:05:35.296294 IP 10.0.5.3.37798 > 10.0.1.1.12345: Flags [P.], seq 1:4, ack 17, win 83, options [nop,nop,TS val 32347662 ecr 978130979], length 3
17:05:35.296297 IP 10.0.1.1.12345 > 10.0.5.3.37798: Flags [.], ack 4, win 85, options [nop,nop,TS val 978130979 ecr 32347662], length 0
17:05:35.296298 IP 10.0.1.1.12345 > 10.0.5.3.37798: Flags [.], ack 4, win 85, options [nop,nop,TS val 978130979 ecr 32347662], length 0
17:05:35.296298 IP 10.0.1.1.12345 > 10.0.5.3.37798: Flags [.], ack 4, win 85, options [nop,nop,TS val 978130979 ecr 32347662], length 0
17:05:35.296298 IP 10.0.1.1.12345 > 10.0.5.3.37798: Flags [.], ack 4, win 85, options [nop,nop,TS val 978130979 ecr 32347662], length 0
17:05:35.296299 IP 10.0.1.1.12345 > 10.0.5.3.37798: Flags [.], ack 4, win 85, options [nop,nop,TS val 978130979 ecr 32347662], length 0
17:05:35.296299 IP 10.0.1.1.12345 > 10.0.5.3.37798: Flags [.], ack 4, win 85, options [nop,nop,TS val 978130979 ecr 32347662], length 0
17:05:36.282013 ARP, Request who-has 10.0.1.1 tell 10.0.5.2, length 28
17:05:36.282101 ARP, Request who-has 10.0.1.1 tell 10.0.5.2, length 28
17:05:36.282103 ARP, Request who-has 10.0.1.1 tell 10.0.5.2, length 28
17:05:36.282104 ARP, Request who-has 10.0.1.1 tell 10.0.5.2, length 28
17:05:36.282108 ARP, Request who-has 10.0.1.1 tell 10.0.5.2, length 28
17:05:36.282133 ARP, Request who-has 10.0.1.1 tell 10.0.5.2, length 28
17:05:36.282135 ARP, Request who-has 10.0.1.1 tell 10.0.5.2, length 28
17:05:36.282136 ARP, Request who-has 10.0.1.1 tell 10.0.5.2, length 28
17:05:36.282137 ARP, Request who-has 10.0.1.1 tell 10.0.5.2, length 28
17:05:36.282138 ARP, Request who-has 10.0.1.1 tell 10.0.5.2, length 28
17:05:36.282140 ARP, Request who-has 10.0.1.1 tell 10.0.5.2, length 28
17:05:36.282142 ARP, Request who-has 10.0.1.1 tell 10.0.5.2, length 28
17:05:36.282144 ARP, Request who-has 10.0.1.1 tell 10.0.5.2, length 28
17:05:36.282187 ARP, Request who-has 10.0.1.1 tell 10.0.5.2, length 28
17:05:36.282189 ARP, Request who-has 10.0.1.1 tell 10.0.5.2, length 28
17:05:36.282190 ARP, Request who-has 10.0.1.1 tell 10.0.5.2, length 28
17:05:36.282198 ARP, Request who-has 10.0.1.1 tell 10.0.5.2, length 28
17:05:36.282200 ARP, Request who-has 10.0.1.1 tell 10.0.5.2, length 28
17:05:36.282200 ARP, Request who-has 10.0.1.1 tell 10.0.5.2, length 28
17:05:36.282212 ARP, Reply 10.0.1.1 is-at 4a:af:d0:53:c7:a1, length 28
17:05:36.282242 ARP, Request who-has 10.0.1.1 tell 10.0.5.2, length 28
17:05:36.282243 ARP, Request who-has 10.0.1.1 tell 10.0.5.2, length 28
17:05:36.282244 ARP, Request who-has 10.0.1.1 tell 10.0.5.2, length 28
17:05:36.282253 ARP, Request who-has 10.0.1.1 tell 10.0.5.2, length 28
17:05:36.282254 ARP, Request who-has 10.0.1.1 tell 10.0.5.2, length 28
17:05:36.282255 ARP, Request who-has 10.0.1.1 tell 10.0.5.2, length 28
17:05:36.282276 ARP, Reply 10.0.1.1 is-at 4a:af:d0:53:c7:a1, length 28
17:05:36.282276 ARP, Reply 10.0.1.1 is-at 4a:af:d0:53:c7:a1, length 28
17:05:36.282290 ARP, Reply 10.0.1.1 is-at 4a:af:d0:53:c7:a1, length 28
17:05:36.282290 ARP, Reply 10.0.1.1 is-at 4a:af:d0:53:c7:a1, length 28
17:05:36.282302 ARP, Reply 10.0.1.1 is-at 4a:af:d0:53:c7:a1, length 28
17:05:36.282306 IP 10.0.5.2.39632 > 10.0.1.1.12345: Flags [S], seq 1081348129, win 42340, options [mss 1460,sackOK,TS val 2100873201 ecr 0,nop,wscale 9], length 0
17:05:36.282320 IP 10.0.5.2.39632 > 10.0.1.1.12345: Flags [S], seq 1081348129, win 42340, options [mss 1460,sackOK,TS val 2100873201 ecr 0,nop,wscale 9], length 0
17:05:36.282321 IP 10.0.5.2.39632 > 10.0.1.1.12345: Flags [S], seq 1081348129, win 42340, options [mss 1460,sackOK,TS val 2100873201 ecr 0,nop,wscale 9], length 0
17:05:36.282332 IP 10.0.5.2.39632 > 10.0.1.1.12345: Flags [S], seq 1081348129, win 42340, options [mss 1460,sackOK,TS val 2100873201 ecr 0,nop,wscale 9], length 0
17:05:36.282333 IP 10.0.5.2.39632 > 10.0.1.1.12345: Flags [S], seq 1081348129, win 42340, options [mss 1460,sackOK,TS val 2100873201 ecr 0,nop,wscale 9], length 0
17:05:36.282344 IP 10.0.5.2.39632 > 10.0.1.1.12345: Flags [S], seq 1081348129, win 42340, options [mss 1460,sackOK,TS val 2100873201 ecr 0,nop,wscale 9], length 0
17:05:36.282356 IP 10.0.1.1.12345 > 10.0.5.2.39632: Flags [S.], seq 520482402, ack 1081348130, win 43440, options [mss 1460,sackOK,TS val 226770325 ecr 2100873201,nop,wscale 9], length 0
17:05:36.282371 IP 10.0.1.1.12345 > 10.0.5.2.39632: Flags [S.], seq 520482402, ack 1081348130, win 43440, options [mss 1460,sackOK,TS val 226770325 ecr 2100873201,nop,wscale 9], length 0
17:05:36.282371 IP 10.0.1.1.12345 > 10.0.5.2.39632: Flags [S.], seq 520482402, ack 1081348130, win 43440, options [mss 1460,sackOK,TS val 226770325 ecr 2100873201,nop,wscale 9], length 0
17:05:36.282383 IP 10.0.1.1.12345 > 10.0.5.2.39632: Flags [S.], seq 520482402, ack 1081348130, win 43440, options [mss 1460,sackOK,TS val 226770325 ecr 2100873201,nop,wscale 9], length 0
17:05:36.282384 IP 10.0.1.1.12345 > 10.0.5.2.39632: Flags [S.], seq 520482402, ack 1081348130, win 43440, options [mss 1460,sackOK,TS val 226770325 ecr 2100873201,nop,wscale 9], length 0
17:05:36.282395 IP 10.0.1.1.12345 > 10.0.5.2.39632: Flags [S.], seq 520482402, ack 1081348130, win 43440, options [mss 1460,sackOK,TS val 226770325 ecr 2100873201,nop,wscale 9], length 0
17:05:36.282405 IP 10.0.5.2.39632 > 10.0.1.1.12345: Flags [.], ack 1, win 83, options [nop,nop,TS val 2100873201 ecr 226770325], length 0
17:05:36.282406 IP 10.0.5.2.39632 > 10.0.1.1.12345: Flags [.], ack 1, win 83, options [nop,nop,TS val 2100873201 ecr 226770325], length 0
17:05:36.282406 IP 10.0.5.2.39632 > 10.0.1.1.12345: Flags [.], ack 1, win 83, options [nop,nop,TS val 2100873201 ecr 226770325], length 0
17:05:36.282406 IP 10.0.5.2.39632 > 10.0.1.1.12345: Flags [.], ack 1, win 83, options [nop,nop,TS val 2100873201 ecr 226770325], length 0
17:05:36.282407 IP 10.0.5.2.39632 > 10.0.1.1.12345: Flags [.], ack 1, win 83, options [nop,nop,TS val 2100873201 ecr 226770325], length 0
17:05:36.282407 IP 10.0.5.2.39632 > 10.0.1.1.12345: Flags [.], ack 1, win 83, options [nop,nop,TS val 2100873201 ecr 226770325], length 0
17:05:36.282501 IP 10.0.1.1.12345 > 10.0.5.2.39632: Flags [P.], seq 1:17, ack 1, win 85, options [nop,nop,TS val 226770325 ecr 2100873201], length 16
17:05:36.282502 IP 10.0.1.1.12345 > 10.0.5.2.39632: Flags [P.], seq 1:17, ack 1, win 85, options [nop,nop,TS val 226770325 ecr 2100873201], length 16
17:05:36.282502 IP 10.0.1.1.12345 > 10.0.5.2.39632: Flags [P.], seq 1:17, ack 1, win 85, options [nop,nop,TS val 226770325 ecr 2100873201], length 16
17:05:36.282503 IP 10.0.1.1.12345 > 10.0.5.2.39632: Flags [P.], seq 1:17, ack 1, win 85, options [nop,nop,TS val 226770325 ecr 2100873201], length 16
17:05:36.282503 IP 10.0.1.1.12345 > 10.0.5.2.39632: Flags [P.], seq 1:17, ack 1, win 85, options [nop,nop,TS val 226770325 ecr 2100873201], length 16
17:05:36.282503 IP 10.0.1.1.12345 > 10.0.5.2.39632: Flags [P.], seq 1:17, ack 1, win 85, options [nop,nop,TS val 226770325 ecr 2100873201], length 16
17:05:36.282507 IP 10.0.5.2.39632 > 10.0.1.1.12345: Flags [.], ack 17, win 83, options [nop,nop,TS val 2100873201 ecr 226770325], length 0
17:05:36.282507 IP 10.0.5.2.39632 > 10.0.1.1.12345: Flags [.], ack 17, win 83, options [nop,nop,TS val 2100873201 ecr 226770325], length 0
17:05:36.282507 IP 10.0.5.2.39632 > 10.0.1.1.12345: Flags [.], ack 17, win 83, options [nop,nop,TS val 2100873201 ecr 226770325], length 0
17:05:36.282507 IP 10.0.5.2.39632 > 10.0.1.1.12345: Flags [.], ack 17, win 83, options [nop,nop,TS val 2100873201 ecr 226770325], length 0
17:05:36.282508 IP 10.0.5.2.39632 > 10.0.1.1.12345: Flags [.], ack 17, win 83, options [nop,nop,TS val 2100873201 ecr 226770325], length 0
17:05:36.282508 IP 10.0.5.2.39632 > 10.0.1.1.12345: Flags [.], ack 17, win 83, options [nop,nop,TS val 2100873201 ecr 226770325], length 0
17:05:36.284619 IP 10.0.5.2.39632 > 10.0.1.1.12345: Flags [P.], seq 1:4, ack 17, win 83, options [nop,nop,TS val 2100873203 ecr 226770325], length 3
17:05:36.284626 IP 10.0.5.2.39632 > 10.0.1.1.12345: Flags [P.], seq 1:4, ack 17, win 83, options [nop,nop,TS val 2100873203 ecr 226770325], length 3
17:05:36.284628 IP 10.0.5.2.39632 > 10.0.1.1.12345: Flags [P.], seq 1:4, ack 17, win 83, options [nop,nop,TS val 2100873203 ecr 226770325], length 3
17:05:36.284630 IP 10.0.5.2.39632 > 10.0.1.1.12345: Flags [P.], seq 1:4, ack 17, win 83, options [nop,nop,TS val 2100873203 ecr 226770325], length 3
17:05:36.284631 IP 10.0.5.2.39632 > 10.0.1.1.12345: Flags [P.], seq 1:4, ack 17, win 83, options [nop,nop,TS val 2100873203 ecr 226770325], length 3
17:05:36.284634 IP 10.0.5.2.39632 > 10.0.1.1.12345: Flags [P.], seq 1:4, ack 17, win 83, options [nop,nop,TS val 2100873203 ecr 226770325], length 3
17:05:36.284652 IP 10.0.1.1.12345 > 10.0.5.2.39632: Flags [.], ack 4, win 85, options [nop,nop,TS val 226770327 ecr 2100873203], length 0
17:05:36.284653 IP 10.0.1.1.12345 > 10.0.5.2.39632: Flags [.], ack 4, win 85, options [nop,nop,TS val 226770327 ecr 2100873203], length 0
17:05:36.284653 IP 10.0.1.1.12345 > 10.0.5.2.39632: Flags [.], ack 4, win 85, options [nop,nop,TS val 226770327 ecr 2100873203], length 0
17:05:36.284654 IP 10.0.1.1.12345 > 10.0.5.2.39632: Flags [.], ack 4, win 85, options [nop,nop,TS val 226770327 ecr 2100873203], length 0
17:05:36.284654 IP 10.0.1.1.12345 > 10.0.5.2.39632: Flags [.], ack 4, win 85, options [nop,nop,TS val 226770327 ecr 2100873203], length 0
17:05:36.284655 IP 10.0.1.1.12345 > 10.0.5.2.39632: Flags [.], ack 4, win 85, options [nop,nop,TS val 226770327 ecr 2100873203], length 0
17:05:36.297306 IP 10.0.5.3.37798 > 10.0.1.1.12345: Flags [F.], seq 4, ack 17, win 83, options [nop,nop,TS val 32348663 ecr 978130979], length 0
17:05:36.297311 IP 10.0.5.3.37798 > 10.0.1.1.12345: Flags [F.], seq 4, ack 17, win 83, options [nop,nop,TS val 32348663 ecr 978130979], length 0
17:05:36.297312 IP 10.0.5.3.37798 > 10.0.1.1.12345: Flags [F.], seq 4, ack 17, win 83, options [nop,nop,TS val 32348663 ecr 978130979], length 0
17:05:36.297313 IP 10.0.5.3.37798 > 10.0.1.1.12345: Flags [F.], seq 4, ack 17, win 83, options [nop,nop,TS val 32348663 ecr 978130979], length 0
17:05:36.297314 IP 10.0.5.3.37798 > 10.0.1.1.12345: Flags [F.], seq 4, ack 17, win 83, options [nop,nop,TS val 32348663 ecr 978130979], length 0
17:05:36.297315 IP 10.0.5.3.37798 > 10.0.1.1.12345: Flags [F.], seq 4, ack 17, win 83, options [nop,nop,TS val 32348663 ecr 978130979], length 0
17:05:36.297382 ARP, Request who-has 10.0.1.2 tell 10.0.5.3, length 28
17:05:36.300176 ARP, Request who-has 10.0.1.2 tell 10.0.5.3, length 28
17:05:36.300178 ARP, Request who-has 10.0.1.2 tell 10.0.5.3, length 28
17:05:36.300179 ARP, Request who-has 10.0.1.2 tell 10.0.5.3, length 28
17:05:36.300186 ARP, Request who-has 10.0.1.2 tell 10.0.5.3, length 28
17:05:36.300225 ARP, Request who-has 10.0.1.2 tell 10.0.5.3, length 28
17:05:36.300226 ARP, Request who-has 10.0.1.2 tell 10.0.5.3, length 28
17:05:36.300227 ARP, Request who-has 10.0.1.2 tell 10.0.5.3, length 28
17:05:36.300228 ARP, Request who-has 10.0.1.2 tell 10.0.5.3, length 28
17:05:36.300229 ARP, Request who-has 10.0.1.2 tell 10.0.5.3, length 28
17:05:36.300231 ARP, Request who-has 10.0.1.2 tell 10.0.5.3, length 28
17:05:36.300234 ARP, Request who-has 10.0.1.2 tell 10.0.5.3, length 28
17:05:36.300236 ARP, Request who-has 10.0.1.2 tell 10.0.5.3, length 28
17:05:36.300285 ARP, Request who-has 10.0.1.2 tell 10.0.5.3, length 28
17:05:36.300286 ARP, Request who-has 10.0.1.2 tell 10.0.5.3, length 28
17:05:36.300287 ARP, Request who-has 10.0.1.2 tell 10.0.5.3, length 28
17:05:36.300296 ARP, Request who-has 10.0.1.2 tell 10.0.5.3, length 28
17:05:36.300298 ARP, Request who-has 10.0.1.2 tell 10.0.5.3, length 28
17:05:36.300299 ARP, Request who-has 10.0.1.2 tell 10.0.5.3, length 28
17:05:36.300316 ARP, Reply 10.0.1.2 is-at c6:13:08:9e:91:82, length 28
17:05:36.300321 ARP, Request who-has 10.0.1.2 tell 10.0.5.3, length 28
17:05:36.300323 ARP, Request who-has 10.0.1.2 tell 10.0.5.3, length 28
17:05:36.300324 ARP, Request who-has 10.0.1.2 tell 10.0.5.3, length 28
17:05:36.300332 ARP, Request who-has 10.0.1.2 tell 10.0.5.3, length 28
17:05:36.300333 ARP, Request who-has 10.0.1.2 tell 10.0.5.3, length 28
17:05:36.300334 ARP, Request who-has 10.0.1.2 tell 10.0.5.3, length 28
17:05:36.300354 ARP, Reply 10.0.1.2 is-at c6:13:08:9e:91:82, length 28
17:05:36.300354 ARP, Reply 10.0.1.2 is-at c6:13:08:9e:91:82, length 28
17:05:36.300368 ARP, Reply 10.0.1.2 is-at c6:13:08:9e:91:82, length 28
17:05:36.300369 ARP, Reply 10.0.1.2 is-at c6:13:08:9e:91:82, length 28
17:05:36.300383 ARP, Reply 10.0.1.2 is-at c6:13:08:9e:91:82, length 28
17:05:36.300394 IP 10.0.5.3.56438 > 10.0.1.2.12345: Flags [S], seq 1909801028, win 42340, options [mss 1460,sackOK,TS val 2438477704 ecr 0,nop,wscale 9], length 0
17:05:36.300415 IP 10.0.5.3.56438 > 10.0.1.2.12345: Flags [S], seq 1909801028, win 42340, options [mss 1460,sackOK,TS val 2438477704 ecr 0,nop,wscale 9], length 0
17:05:36.300416 IP 10.0.5.3.56438 > 10.0.1.2.12345: Flags [S], seq 1909801028, win 42340, options [mss 1460,sackOK,TS val 2438477704 ecr 0,nop,wscale 9], length 0
17:05:36.300431 IP 10.0.5.3.56438 > 10.0.1.2.12345: Flags [S], seq 1909801028, win 42340, options [mss 1460,sackOK,TS val 2438477704 ecr 0,nop,wscale 9], length 0
17:05:36.300432 IP 10.0.5.3.56438 > 10.0.1.2.12345: Flags [S], seq 1909801028, win 42340, options [mss 1460,sackOK,TS val 2438477704 ecr 0,nop,wscale 9], length 0
17:05:36.300446 IP 10.0.5.3.56438 > 10.0.1.2.12345: Flags [S], seq 1909801028, win 42340, options [mss 1460,sackOK,TS val 2438477704 ecr 0,nop,wscale 9], length 0
17:05:36.300511 IP 10.0.1.2.12345 > 10.0.5.3.56438: Flags [S.], seq 1958466744, ack 1909801029, win 43440, options [mss 1460,sackOK,TS val 3416587789 ecr 2438477704,nop,wscale 9], length 0
17:05:36.300529 IP 10.0.1.2.12345 > 10.0.5.3.56438: Flags [S.], seq 1958466744, ack 1909801029, win 43440, options [mss 1460,sackOK,TS val 3416587789 ecr 2438477704,nop,wscale 9], length 0
17:05:36.300529 IP 10.0.1.2.12345 > 10.0.5.3.56438: Flags [S.], seq 1958466744, ack 1909801029, win 43440, options [mss 1460,sackOK,TS val 3416587789 ecr 2438477704,nop,wscale 9], length 0
17:05:36.300543 IP 10.0.1.2.12345 > 10.0.5.3.56438: Flags [S.], seq 1958466744, ack 1909801029, win 43440, options [mss 1460,sackOK,TS val 3416587789 ecr 2438477704,nop,wscale 9], length 0
17:05:36.300543 IP 10.0.1.2.12345 > 10.0.5.3.56438: Flags [S.], seq 1958466744, ack 1909801029, win 43440, options [mss 1460,sackOK,TS val 3416587789 ecr 2438477704,nop,wscale 9], length 0
17:05:36.300557 IP 10.0.1.2.12345 > 10.0.5.3.56438: Flags [S.], seq 1958466744, ack 1909801029, win 43440, options [mss 1460,sackOK,TS val 3416587789 ecr 2438477704,nop,wscale 9], length 0
17:05:36.300599 IP 10.0.5.3.56438 > 10.0.1.2.12345: Flags [.], ack 1, win 83, options [nop,nop,TS val 2438477707 ecr 3416587789], length 0
17:05:36.300600 IP 10.0.5.3.56438 > 10.0.1.2.12345: Flags [.], ack 1, win 83, options [nop,nop,TS val 2438477707 ecr 3416587789], length 0
17:05:36.300601 IP 10.0.5.3.56438 > 10.0.1.2.12345: Flags [.], ack 1, win 83, options [nop,nop,TS val 2438477707 ecr 3416587789], length 0
17:05:36.300601 IP 10.0.5.3.56438 > 10.0.1.2.12345: Flags [.], ack 1, win 83, options [nop,nop,TS val 2438477707 ecr 3416587789], length 0
17:05:36.300601 IP 10.0.5.3.56438 > 10.0.1.2.12345: Flags [.], ack 1, win 83, options [nop,nop,TS val 2438477707 ecr 3416587789], length 0
17:05:36.300602 IP 10.0.5.3.56438 > 10.0.1.2.12345: Flags [.], ack 1, win 83, options [nop,nop,TS val 2438477707 ecr 3416587789], length 0
17:05:36.301002 IP 10.0.1.2.12345 > 10.0.5.3.56438: Flags [P.], seq 1:17, ack 1, win 85, options [nop,nop,TS val 3416587790 ecr 2438477707], length 16
17:05:36.301003 IP 10.0.1.2.12345 > 10.0.5.3.56438: Flags [P.], seq 1:17, ack 1, win 85, options [nop,nop,TS val 3416587790 ecr 2438477707], length 16
17:05:36.301004 IP 10.0.1.2.12345 > 10.0.5.3.56438: Flags [P.], seq 1:17, ack 1, win 85, options [nop,nop,TS val 3416587790 ecr 2438477707], length 16
17:05:36.301004 IP 10.0.1.2.12345 > 10.0.5.3.56438: Flags [P.], seq 1:17, ack 1, win 85, options [nop,nop,TS val 3416587790 ecr 2438477707], length 16
17:05:36.301004 IP 10.0.1.2.12345 > 10.0.5.3.56438: Flags [P.], seq 1:17, ack 1, win 85, options [nop,nop,TS val 3416587790 ecr 2438477707], length 16
17:05:36.301005 IP 10.0.1.2.12345 > 10.0.5.3.56438: Flags [P.], seq 1:17, ack 1, win 85, options [nop,nop,TS val 3416587790 ecr 2438477707], length 16
17:05:36.301008 IP 10.0.5.3.56438 > 10.0.1.2.12345: Flags [.], ack 17, win 83, options [nop,nop,TS val 2438477708 ecr 3416587790], length 0
17:05:36.301009 IP 10.0.5.3.56438 > 10.0.1.2.12345: Flags [.], ack 17, win 83, options [nop,nop,TS val 2438477708 ecr 3416587790], length 0
17:05:36.301009 IP 10.0.5.3.56438 > 10.0.1.2.12345: Flags [.], ack 17, win 83, options [nop,nop,TS val 2438477708 ecr 3416587790], length 0
17:05:36.301009 IP 10.0.5.3.56438 > 10.0.1.2.12345: Flags [.], ack 17, win 83, options [nop,nop,TS val 2438477708 ecr 3416587790], length 0
17:05:36.301009 IP 10.0.5.3.56438 > 10.0.1.2.12345: Flags [.], ack 17, win 83, options [nop,nop,TS val 2438477708 ecr 3416587790], length 0
17:05:36.301010 IP 10.0.5.3.56438 > 10.0.1.2.12345: Flags [.], ack 17, win 83, options [nop,nop,TS val 2438477708 ecr 3416587790], length 0
17:05:36.303399 IP 10.0.5.3.56438 > 10.0.1.2.12345: Flags [P.], seq 1:4, ack 17, win 83, options [nop,nop,TS val 2438477710 ecr 3416587790], length 3
17:05:36.303406 IP 10.0.5.3.56438 > 10.0.1.2.12345: Flags [P.], seq 1:4, ack 17, win 83, options [nop,nop,TS val 2438477710 ecr 3416587790], length 3
17:05:36.303407 IP 10.0.5.3.56438 > 10.0.1.2.12345: Flags [P.], seq 1:4, ack 17, win 83, options [nop,nop,TS val 2438477710 ecr 3416587790], length 3
17:05:36.303408 IP 10.0.5.3.56438 > 10.0.1.2.12345: Flags [P.], seq 1:4, ack 17, win 83, options [nop,nop,TS val 2438477710 ecr 3416587790], length 3
17:05:36.303409 IP 10.0.5.3.56438 > 10.0.1.2.12345: Flags [P.], seq 1:4, ack 17, win 83, options [nop,nop,TS val 2438477710 ecr 3416587790], length 3
17:05:36.303411 IP 10.0.5.3.56438 > 10.0.1.2.12345: Flags [P.], seq 1:4, ack 17, win 83, options [nop,nop,TS val 2438477710 ecr 3416587790], length 3
17:05:36.303427 IP 10.0.1.2.12345 > 10.0.5.3.56438: Flags [.], ack 4, win 85, options [nop,nop,TS val 3416587792 ecr 2438477710], length 0
17:05:36.303428 IP 10.0.1.2.12345 > 10.0.5.3.56438: Flags [.], ack 4, win 85, options [nop,nop,TS val 3416587792 ecr 2438477710], length 0
17:05:36.303429 IP 10.0.1.2.12345 > 10.0.5.3.56438: Flags [.], ack 4, win 85, options [nop,nop,TS val 3416587792 ecr 2438477710], length 0
17:05:36.303430 IP 10.0.1.2.12345 > 10.0.5.3.56438: Flags [.], ack 4, win 85, options [nop,nop,TS val 3416587792 ecr 2438477710], length 0
17:05:36.303431 IP 10.0.1.2.12345 > 10.0.5.3.56438: Flags [.], ack 4, win 85, options [nop,nop,TS val 3416587792 ecr 2438477710], length 0
17:05:36.303433 IP 10.0.1.2.12345 > 10.0.5.3.56438: Flags [.], ack 4, win 85, options [nop,nop,TS val 3416587792 ecr 2438477710], length 0
17:05:36.339287 IP 10.0.1.1.12345 > 10.0.5.3.37798: Flags [.], ack 5, win 85, options [nop,nop,TS val 978132022 ecr 32348663], length 0
17:05:36.339296 IP 10.0.1.1.12345 > 10.0.5.3.37798: Flags [.], ack 5, win 85, options [nop,nop,TS val 978132022 ecr 32348663], length 0
17:05:36.339299 IP 10.0.1.1.12345 > 10.0.5.3.37798: Flags [.], ack 5, win 85, options [nop,nop,TS val 978132022 ecr 32348663], length 0
17:05:36.339301 IP 10.0.1.1.12345 > 10.0.5.3.37798: Flags [.], ack 5, win 85, options [nop,nop,TS val 978132022 ecr 32348663], length 0
17:05:36.339302 IP 10.0.1.1.12345 > 10.0.5.3.37798: Flags [.], ack 5, win 85, options [nop,nop,TS val 978132022 ecr 32348663], length 0
17:05:36.339305 IP 10.0.1.1.12345 > 10.0.5.3.37798: Flags [.], ack 5, win 85, options [nop,nop,TS val 978132022 ecr 32348663], length 0
17:05:37.285580 IP 10.0.5.2.39632 > 10.0.1.1.12345: Flags [F.], seq 4, ack 17, win 83, options [nop,nop,TS val 2100874204 ecr 226770327], length 0
17:05:37.285585 IP 10.0.5.2.39632 > 10.0.1.1.12345: Flags [F.], seq 4, ack 17, win 83, options [nop,nop,TS val 2100874204 ecr 226770327], length 0
17:05:37.285586 IP 10.0.5.2.39632 > 10.0.1.1.12345: Flags [F.], seq 4, ack 17, win 83, options [nop,nop,TS val 2100874204 ecr 226770327], length 0
17:05:37.285588 IP 10.0.5.2.39632 > 10.0.1.1.12345: Flags [F.], seq 4, ack 17, win 83, options [nop,nop,TS val 2100874204 ecr 226770327], length 0
17:05:37.285588 IP 10.0.5.2.39632 > 10.0.1.1.12345: Flags [F.], seq 4, ack 17, win 83, options [nop,nop,TS val 2100874204 ecr 226770327], length 0
17:05:37.285590 IP 10.0.5.2.39632 > 10.0.1.1.12345: Flags [F.], seq 4, ack 17, win 83, options [nop,nop,TS val 2100874204 ecr 226770327], length 0
17:05:37.285654 ARP, Request who-has 10.0.1.2 tell 10.0.5.2, length 28
17:05:37.285743 ARP, Request who-has 10.0.1.2 tell 10.0.5.2, length 28
17:05:37.285744 ARP, Request who-has 10.0.1.2 tell 10.0.5.2, length 28
17:05:37.285744 ARP, Request who-has 10.0.1.2 tell 10.0.5.2, length 28
17:05:37.285747 ARP, Request who-has 10.0.1.2 tell 10.0.5.2, length 28
17:05:37.285773 ARP, Request who-has 10.0.1.2 tell 10.0.5.2, length 28
17:05:37.285774 ARP, Request who-has 10.0.1.2 tell 10.0.5.2, length 28
17:05:37.285775 ARP, Request who-has 10.0.1.2 tell 10.0.5.2, length 28
17:05:37.285776 ARP, Request who-has 10.0.1.2 tell 10.0.5.2, length 28
17:05:37.285777 ARP, Request who-has 10.0.1.2 tell 10.0.5.2, length 28
17:05:37.285778 ARP, Request who-has 10.0.1.2 tell 10.0.5.2, length 28
17:05:37.285780 ARP, Request who-has 10.0.1.2 tell 10.0.5.2, length 28
17:05:37.285786 ARP, Request who-has 10.0.1.2 tell 10.0.5.2, length 28
17:05:37.285827 ARP, Request who-has 10.0.1.2 tell 10.0.5.2, length 28
17:05:37.285829 ARP, Request who-has 10.0.1.2 tell 10.0.5.2, length 28
17:05:37.285830 ARP, Request who-has 10.0.1.2 tell 10.0.5.2, length 28
17:05:37.285839 ARP, Request who-has 10.0.1.2 tell 10.0.5.2, length 28
17:05:37.285840 ARP, Request who-has 10.0.1.2 tell 10.0.5.2, length 28
17:05:37.285841 ARP, Request who-has 10.0.1.2 tell 10.0.5.2, length 28
17:05:37.285852 ARP, Reply 10.0.1.2 is-at c6:13:08:9e:91:82, length 28
17:05:37.285857 ARP, Request who-has 10.0.1.2 tell 10.0.5.2, length 28
17:05:37.285858 ARP, Request who-has 10.0.1.2 tell 10.0.5.2, length 28
17:05:37.285859 ARP, Request who-has 10.0.1.2 tell 10.0.5.2, length 28
17:05:37.285867 ARP, Request who-has 10.0.1.2 tell 10.0.5.2, length 28
17:05:37.285868 ARP, Request who-has 10.0.1.2 tell 10.0.5.2, length 28
17:05:37.285870 ARP, Request who-has 10.0.1.2 tell 10.0.5.2, length 28
17:05:37.285888 ARP, Reply 10.0.1.2 is-at c6:13:08:9e:91:82, length 28
17:05:37.285889 ARP, Reply 10.0.1.2 is-at c6:13:08:9e:91:82, length 28
17:05:37.285902 ARP, Reply 10.0.1.2 is-at c6:13:08:9e:91:82, length 28
17:05:37.285902 ARP, Reply 10.0.1.2 is-at c6:13:08:9e:91:82, length 28
17:05:37.285915 ARP, Reply 10.0.1.2 is-at c6:13:08:9e:91:82, length 28
17:05:37.285917 IP 10.0.5.2.60686 > 10.0.1.2.12345: Flags [S], seq 3665540796, win 42340, options [mss 1460,sackOK,TS val 300760418 ecr 0,nop,wscale 9], length 0
17:05:37.285932 IP 10.0.5.2.60686 > 10.0.1.2.12345: Flags [S], seq 3665540796, win 42340, options [mss 1460,sackOK,TS val 300760418 ecr 0,nop,wscale 9], length 0
17:05:37.285932 IP 10.0.5.2.60686 > 10.0.1.2.12345: Flags [S], seq 3665540796, win 42340, options [mss 1460,sackOK,TS val 300760418 ecr 0,nop,wscale 9], length 0
17:05:37.285943 IP 10.0.5.2.60686 > 10.0.1.2.12345: Flags [S], seq 3665540796, win 42340, options [mss 1460,sackOK,TS val 300760418 ecr 0,nop,wscale 9], length 0
17:05:37.285944 IP 10.0.5.2.60686 > 10.0.1.2.12345: Flags [S], seq 3665540796, win 42340, options [mss 1460,sackOK,TS val 300760418 ecr 0,nop,wscale 9], length 0
17:05:37.285955 IP 10.0.5.2.60686 > 10.0.1.2.12345: Flags [S], seq 3665540796, win 42340, options [mss 1460,sackOK,TS val 300760418 ecr 0,nop,wscale 9], length 0
17:05:37.285964 IP 10.0.1.2.12345 > 10.0.5.2.60686: Flags [S.], seq 3761558705, ack 3665540797, win 43440, options [mss 1460,sackOK,TS val 430735247 ecr 300760418,nop,wscale 9], length 0
17:05:37.285978 IP 10.0.1.2.12345 > 10.0.5.2.60686: Flags [S.], seq 3761558705, ack 3665540797, win 43440, options [mss 1460,sackOK,TS val 430735247 ecr 300760418,nop,wscale 9], length 0
17:05:37.285979 IP 10.0.1.2.12345 > 10.0.5.2.60686: Flags [S.], seq 3761558705, ack 3665540797, win 43440, options [mss 1460,sackOK,TS val 430735247 ecr 300760418,nop,wscale 9], length 0
17:05:37.285990 IP 10.0.1.2.12345 > 10.0.5.2.60686: Flags [S.], seq 3761558705, ack 3665540797, win 43440, options [mss 1460,sackOK,TS val 430735247 ecr 300760418,nop,wscale 9], length 0
17:05:37.285990 IP 10.0.1.2.12345 > 10.0.5.2.60686: Flags [S.], seq 3761558705, ack 3665540797, win 43440, options [mss 1460,sackOK,TS val 430735247 ecr 300760418,nop,wscale 9], length 0
17:05:37.286002 IP 10.0.1.2.12345 > 10.0.5.2.60686: Flags [S.], seq 3761558705, ack 3665540797, win 43440, options [mss 1460,sackOK,TS val 430735247 ecr 300760418,nop,wscale 9], length 0
17:05:37.286011 IP 10.0.5.2.60686 > 10.0.1.2.12345: Flags [.], ack 1, win 83, options [nop,nop,TS val 300760419 ecr 430735247], length 0
17:05:37.286011 IP 10.0.5.2.60686 > 10.0.1.2.12345: Flags [.], ack 1, win 83, options [nop,nop,TS val 300760419 ecr 430735247], length 0
17:05:37.286012 IP 10.0.5.2.60686 > 10.0.1.2.12345: Flags [.], ack 1, win 83, options [nop,nop,TS val 300760419 ecr 430735247], length 0
17:05:37.286012 IP 10.0.5.2.60686 > 10.0.1.2.12345: Flags [.], ack 1, win 83, options [nop,nop,TS val 300760419 ecr 430735247], length 0
17:05:37.286012 IP 10.0.5.2.60686 > 10.0.1.2.12345: Flags [.], ack 1, win 83, options [nop,nop,TS val 300760419 ecr 430735247], length 0
17:05:37.286013 IP 10.0.5.2.60686 > 10.0.1.2.12345: Flags [.], ack 1, win 83, options [nop,nop,TS val 300760419 ecr 430735247], length 0
17:05:37.286156 IP 10.0.1.2.12345 > 10.0.5.2.60686: Flags [P.], seq 1:17, ack 1, win 85, options [nop,nop,TS val 430735247 ecr 300760419], length 16
17:05:37.286157 IP 10.0.1.2.12345 > 10.0.5.2.60686: Flags [P.], seq 1:17, ack 1, win 85, options [nop,nop,TS val 430735247 ecr 300760419], length 16
17:05:37.286157 IP 10.0.1.2.12345 > 10.0.5.2.60686: Flags [P.], seq 1:17, ack 1, win 85, options [nop,nop,TS val 430735247 ecr 300760419], length 16
17:05:37.286158 IP 10.0.1.2.12345 > 10.0.5.2.60686: Flags [P.], seq 1:17, ack 1, win 85, options [nop,nop,TS val 430735247 ecr 300760419], length 16
17:05:37.286158 IP 10.0.1.2.12345 > 10.0.5.2.60686: Flags [P.], seq 1:17, ack 1, win 85, options [nop,nop,TS val 430735247 ecr 300760419], length 16
17:05:37.286158 IP 10.0.1.2.12345 > 10.0.5.2.60686: Flags [P.], seq 1:17, ack 1, win 85, options [nop,nop,TS val 430735247 ecr 300760419], length 16
17:05:37.286161 IP 10.0.5.2.60686 > 10.0.1.2.12345: Flags [.], ack 17, win 83, options [nop,nop,TS val 300760419 ecr 430735247], length 0
17:05:37.286162 IP 10.0.5.2.60686 > 10.0.1.2.12345: Flags [.], ack 17, win 83, options [nop,nop,TS val 300760419 ecr 430735247], length 0
17:05:37.286162 IP 10.0.5.2.60686 > 10.0.1.2.12345: Flags [.], ack 17, win 83, options [nop,nop,TS val 300760419 ecr 430735247], length 0
17:05:37.286162 IP 10.0.5.2.60686 > 10.0.1.2.12345: Flags [.], ack 17, win 83, options [nop,nop,TS val 300760419 ecr 430735247], length 0
17:05:37.286162 IP 10.0.5.2.60686 > 10.0.1.2.12345: Flags [.], ack 17, win 83, options [nop,nop,TS val 300760419 ecr 430735247], length 0
17:05:37.286163 IP 10.0.5.2.60686 > 10.0.1.2.12345: Flags [.], ack 17, win 83, options [nop,nop,TS val 300760419 ecr 430735247], length 0
17:05:37.286245 IP 10.0.5.2.60686 > 10.0.1.2.12345: Flags [P.], seq 1:4, ack 17, win 83, options [nop,nop,TS val 300760419 ecr 430735247], length 3
17:05:37.286246 IP 10.0.5.2.60686 > 10.0.1.2.12345: Flags [P.], seq 1:4, ack 17, win 83, options [nop,nop,TS val 300760419 ecr 430735247], length 3
17:05:37.286247 IP 10.0.5.2.60686 > 10.0.1.2.12345: Flags [P.], seq 1:4, ack 17, win 83, options [nop,nop,TS val 300760419 ecr 430735247], length 3
17:05:37.286247 IP 10.0.5.2.60686 > 10.0.1.2.12345: Flags [P.], seq 1:4, ack 17, win 83, options [nop,nop,TS val 300760419 ecr 430735247], length 3
17:05:37.286247 IP 10.0.5.2.60686 > 10.0.1.2.12345: Flags [P.], seq 1:4, ack 17, win 83, options [nop,nop,TS val 300760419 ecr 430735247], length 3
17:05:37.286248 IP 10.0.5.2.60686 > 10.0.1.2.12345: Flags [P.], seq 1:4, ack 17, win 83, options [nop,nop,TS val 300760419 ecr 430735247], length 3
17:05:37.286251 IP 10.0.1.2.12345 > 10.0.5.2.60686: Flags [.], ack 4, win 85, options [nop,nop,TS val 430735247 ecr 300760419], length 0
17:05:37.286251 IP 10.0.1.2.12345 > 10.0.5.2.60686: Flags [.], ack 4, win 85, options [nop,nop,TS val 430735247 ecr 300760419], length 0
17:05:37.286251 IP 10.0.1.2.12345 > 10.0.5.2.60686: Flags [.], ack 4, win 85, options [nop,nop,TS val 430735247 ecr 300760419], length 0
17:05:37.286252 IP 10.0.1.2.12345 > 10.0.5.2.60686: Flags [.], ack 4, win 85, options [nop,nop,TS val 430735247 ecr 300760419], length 0
17:05:37.286252 IP 10.0.1.2.12345 > 10.0.5.2.60686: Flags [.], ack 4, win 85, options [nop,nop,TS val 430735247 ecr 300760419], length 0
17:05:37.286252 IP 10.0.1.2.12345 > 10.0.5.2.60686: Flags [.], ack 4, win 85, options [nop,nop,TS val 430735247 ecr 300760419], length 0
17:05:37.304391 IP 10.0.5.3.56438 > 10.0.1.2.12345: Flags [F.], seq 4, ack 17, win 83, options [nop,nop,TS val 2438478711 ecr 3416587792], length 0
17:05:37.304409 IP 10.0.5.3.56438 > 10.0.1.2.12345: Flags [F.], seq 4, ack 17, win 83, options [nop,nop,TS val 2438478711 ecr 3416587792], length 0
17:05:37.304411 IP 10.0.5.3.56438 > 10.0.1.2.12345: Flags [F.], seq 4, ack 17, win 83, options [nop,nop,TS val 2438478711 ecr 3416587792], length 0
17:05:37.304415 IP 10.0.5.3.56438 > 10.0.1.2.12345: Flags [F.], seq 4, ack 17, win 83, options [nop,nop,TS val 2438478711 ecr 3416587792], length 0
17:05:37.304416 IP 10.0.5.3.56438 > 10.0.1.2.12345: Flags [F.], seq 4, ack 17, win 83, options [nop,nop,TS val 2438478711 ecr 3416587792], length 0
17:05:37.304420 IP 10.0.5.3.56438 > 10.0.1.2.12345: Flags [F.], seq 4, ack 17, win 83, options [nop,nop,TS val 2438478711 ecr 3416587792], length 0
17:05:37.304494 ARP, Request who-has 10.0.1.3 tell 10.0.5.3, length 28
17:05:37.307143 ARP, Request who-has 10.0.1.3 tell 10.0.5.3, length 28
17:05:37.307145 ARP, Request who-has 10.0.1.3 tell 10.0.5.3, length 28
17:05:37.307146 ARP, Request who-has 10.0.1.3 tell 10.0.5.3, length 28
17:05:37.307162 ARP, Request who-has 10.0.1.3 tell 10.0.5.3, length 28
17:05:37.307210 ARP, Request who-has 10.0.1.3 tell 10.0.5.3, length 28
17:05:37.307211 ARP, Request who-has 10.0.1.3 tell 10.0.5.3, length 28
17:05:37.307213 ARP, Request who-has 10.0.1.3 tell 10.0.5.3, length 28
17:05:37.307215 ARP, Request who-has 10.0.1.3 tell 10.0.5.3, length 28
17:05:37.307215 ARP, Request who-has 10.0.1.3 tell 10.0.5.3, length 28
17:05:37.307218 ARP, Request who-has 10.0.1.3 tell 10.0.5.3, length 28
17:05:37.307221 ARP, Request who-has 10.0.1.3 tell 10.0.5.3, length 28
17:05:37.307223 ARP, Request who-has 10.0.1.3 tell 10.0.5.3, length 28
17:05:37.307294 ARP, Request who-has 10.0.1.3 tell 10.0.5.3, length 28
17:05:37.307297 ARP, Request who-has 10.0.1.3 tell 10.0.5.3, length 28
17:05:37.307298 ARP, Request who-has 10.0.1.3 tell 10.0.5.3, length 28
17:05:37.307310 ARP, Request who-has 10.0.1.3 tell 10.0.5.3, length 28
17:05:37.307312 ARP, Request who-has 10.0.1.3 tell 10.0.5.3, length 28
17:05:37.307313 ARP, Request who-has 10.0.1.3 tell 10.0.5.3, length 28
17:05:37.307334 ARP, Reply 10.0.1.3 is-at f2:7a:a8:12:34:c6, length 28
17:05:37.307343 ARP, Request who-has 10.0.1.3 tell 10.0.5.3, length 28
17:05:37.307345 ARP, Request who-has 10.0.1.3 tell 10.0.5.3, length 28
17:05:37.307346 ARP, Request who-has 10.0.1.3 tell 10.0.5.3, length 28
17:05:37.307356 ARP, Request who-has 10.0.1.3 tell 10.0.5.3, length 28
17:05:37.307358 ARP, Request who-has 10.0.1.3 tell 10.0.5.3, length 28
17:05:37.307363 ARP, Request who-has 10.0.1.3 tell 10.0.5.3, length 28
17:05:37.307402 ARP, Reply 10.0.1.3 is-at f2:7a:a8:12:34:c6, length 28
17:05:37.307403 ARP, Reply 10.0.1.3 is-at f2:7a:a8:12:34:c6, length 28
17:05:37.307417 ARP, Reply 10.0.1.3 is-at f2:7a:a8:12:34:c6, length 28
17:05:37.307418 ARP, Reply 10.0.1.3 is-at f2:7a:a8:12:34:c6, length 28
17:05:37.307434 ARP, Reply 10.0.1.3 is-at f2:7a:a8:12:34:c6, length 28
